link,city,street,price,type,rooms,surface,furnished,description,description_eng,near_school,near_hospital,near_public_transport,near_services,photos
https://directwonen.nl/huurwoningen-huren/groningen/kleine-kruisstraat/appartement-516859,Groningen,Kleine Kruisstraat,1042.0,APPARTMENT,3.0,55.0,Gestoffeerd,"De Kleine Kruisstraat bevindt zich in een rustige wijk, op loopafstand van het Noorderplantsoen. Het centrum van Groningen ligt op slechts 5 minuten fietsen. Verder zijn er supermarkten, winkels en restaurants in de directe omgeving. Indeling Bij binnenkomst in de woning kom je in de hal. Vanuit hier zijn de woonkamer en open keuken gemakkelijk te bereiken. De woonkamer met open keuken is circa 24 m² groot. De keuken is voorzien van een inbouwafzuigkap. Vanuit de woonkamer bereik je de twee ruime slaapkamers van maar liefst 14 m² en 12 m². Beide slaapkamers beschikken over een eigen wastafel. De badkamer is voorzien van een inloopdouche, wastafel en toilet. Tot slot beschikt de woning over een achtertuin van maar liefst 14 m². Bereikbaarheid Het appartement is eenvoudig bereikbaar met het openbaar vervoer, de fiets en de auto. Het treinstation van Groningen bevindt zich op 5 minuten fietsafstand. Parkeren Het is mogelijk een parkeervergunning aan te vragen bij de gemeente Groningen. Met deze vergunning kun je in de gehele wijk parkeren. Kenmerken - Mogelijkheid tot het aanvragen van huurtoeslag - Centrale locatie - Eigen tuin Huurvoorwaarden - Huurprijs: € 1.042,00 exclusief - Waarborgsom: gelijk aan één maand huur - Beschikbaar vanaf 1 juli 2026 Interesse? Indien je interesse hebt in dit schitterende appartement kan je een bericht versturen","The Kleine Kruisstraat is located in a quiet neighborhood, within walking distance of the Noorderplantsoen. The center of Groningen is just a 5-minute bike ride away. There are also supermarkets, shops and restaurants in the immediate vicinity. Layout When you enter the house you enter the hall. The living room and open kitchen are easily accessible from here. The living room with open kitchen is approximately 24 m². The kitchen is equipped with a built-in extractor hood. From the living room you reach the two spacious bedrooms of no less than 14 m² and 12 m². Both bedrooms have their own sink. The bathroom has a walk-in shower, sink and toilet. Finally, the house has a backyard of no less than 14 m². Accessibility The apartment is easily accessible by public transport, bicycle and car. Groningen train station is a 5-minute bike ride away. Parking It is possible to apply for a parking permit from the municipality of Groningen. With this permit you can park in the entire neighborhood. Features - Possibility to apply for rental allowance - Central location - Own garden Rental conditions - Rental price: € 1,042.00 exclusive - Deposit: equal to one month's rent - Available from July 1, 2026 Interested? If you are interested in this beautiful apartment you can send a message",0,0,1,1,"['https://resources.directwonen.nl/image/274cc272-c9ac-42cd-a33f-0ea62ba62fb6', 'https://resources.directwonen.nl/image/80eaf376-3b2a-4252-a586-3d1c1397ca44', 'https://resources.directwonen.nl/image/f3d9e735-f97e-42db-bad0-3820bbde28a5', 'https://resources.directwonen.nl/image/44a56641-1281-402c-89f4-18092607b86d', 'https://resources.directwonen.nl/image/4f519d14-83b2-4b60-9841-8ff07e2e6243']"
https://directwonen.nl/huurwoningen-huren/groningen/e.-thomassen-a-thuessinklaan/kamer-516860,Groningen,E. Thomassen a Thuessinklaan,475.0,STUDIO-ROOM,1.0,14.0,Gestoffeerd,"Studentenkamer gelegen op de tweede verdieping met een aparte woonkamer en slaapkamer. De keuken, douche en toilet worden gedeeld met de andere 2 bewoners. De huurprijs is exclusief gas, water, elektra, tv, internet en gemeentelijke belastingen.","Student room located on the second floor with a separate living room and bedroom. The kitchen, shower and toilet are shared with the other 2 residents. The rental price is exclusive of gas, water, electricity, TV, internet and municipal taxes.",0,0,0,0,['https://resources.directwonen.nl/image/818995d5-7371-49fe-a3db-8ce7e0c2fa3a']
https://directwonen.nl/huurwoningen-huren/groningen/koeriersterweg/appartement-516858,Groningen,Koeriersterweg,1237.0,APPARTMENT,2.0,50.0,Gestoffeerd,"De huurprijs is onder voorbehoud en kan daarom nog wijzigen. Direct achter één van de bekendste gebouwen van de stad Groningen – de tabaksfabriek van Niemeijer – staat Tabakko; een wooncomplex voor jongvolwassenen. Het pand aan de Koeriersterweg is een object dat is omgetoverd tot een modern wooncomplex met een retro karakter. Dit complex telt maar liefst 56 appartementen verdeeld over 4 woonlagen met ieder een eigen woonkamer, slaapkamer en badkamer. Tevens beschikt dit complex over een gemeenschappelijke fietsenberging en dakterras. Omgeving: Gelegen nabij de Paterswoldseweg naast goede uitvalswegen gelegen zoals de A7 richting Leeuwarden, Drachten en/of de A28 naar Assen, Zwolle. Daarnaast ligt het Stadspark om de hoek. Het Centraal Station is op loopafstand en de Grote Markt is nog geen 10 minuten fietsen. Indeling: Het complex heeft een grote centrale hal waar de brievenbussen zitten en een grote gezamenlijke fietsenkelder welke via de zijkant van het gebouw te bereiken is. Uiteraard voor de sportievelingen kan je ook met de trap. Bij binnenkomst kom je in de hal met toegang tot de woonkamer, slaapkamer, badkamer, separaat toilet. De woonkamer met open keuken is circa 27 m2 ruim. De keuken is voorzien van een afzuigkap, inbouw koelkast met vriesvakje, inductiekookplaat en vaatwasmachine. De slaapkamer is circa 12 m2 ruim. De badkamer beschikt over een wasbak, douche en wasmachineaansluiting. Tot slot is er een apart toilet te vinden in de hal. Deze woning bevindt zich op de begane grond en beschikt over een privé buitenruimte. Bereikbaarheid: De woning is goed bereikbaar met veel voorzieningen in de buurt. Gesitueerd op fietsafstand van het centrum van Groningen. Daarnaast is de dichtstbijzijnde uitvalsweg in de nabije omgeving op slechts 1 minuten rijden. Huurprijsopbouw (onder voorbehoud): Kale huur: € 1.097,61 Voorschot GWE € 120,00 Servicekosten € 20,00 Totale huurprijs = € 1.237,61 Bijzonderheden: - Groot gedeeld dakterras; - Afsluitbare (inpandige) fietsenstalling; - Huisdieren niet toegestaan; - Huurtoeslag is mogelijk; - Waarborgsom gelijk aan 1 maand huur.","The rental price is subject to change and is therefore subject to change. Directly behind one of the most famous buildings in the city of Groningen – the Niemeijer tobacco factory – stands Tabakko; a residential complex for young adults. The building on Koeriersterweg is an object that has been transformed into a modern residential complex with a retro character. This complex has no fewer than 56 apartments spread over 4 floors, each with its own living room, bedroom and bathroom. This complex also has a communal bicycle shed and roof terrace. Environment: Located near the Paterswoldseweg next to good arterial roads such as the A7 towards Leeuwarden, Drachten and/or the A28 to Assen, Zwolle. In addition, the City Park is around the corner. Central Station is within walking distance and the Grote Markt is less than 10 minutes by bike. Layout: The complex has a large central hall where the mailboxes are located and a large shared bicycle cellar which can be reached via the side of the building. Of course, for the sporty ones, you can also use the stairs. Upon entering you enter the hall with access to the living room, bedroom, bathroom, separate toilet. The living room with open kitchen is approximately 27 m2. The kitchen is equipped with an extractor hood, built-in refrigerator with freezer, induction hob and dishwasher. The bedroom is approximately 12 m2. The bathroom has a sink, shower and washing machine connection. Finally, there is a separate toilet in the hall. This house is located on the ground floor and has a private outdoor area. Accessibility: The house is easily accessible with many amenities nearby. Situated within cycling distance of the center of Groningen. In addition, the nearest exit road in the vicinity is just a 1-minute drive away. Rental price structure (subject to change): Basic rent: € 1,097.61 Advance GWE € 120.00 Service costs € 20.00 Total rental price = € 1,237.61 Special features: - Large shared roof terrace; - Lockable (indoor) bicycle shed; - Pets not allowed; - Rent allowance is possible; - Deposit equal to 1 month's rent.",0,0,1,1,"['https://resources.directwonen.nl/image/270c635c-4608-44c2-b5c2-224094346c00', 'https://resources.directwonen.nl/image/3b4127be-c261-43fe-8f82-d18ba5255ab0', 'https://resources.directwonen.nl/image/e5f2d051-2375-42de-808a-0ec3210109d2', 'https://resources.directwonen.nl/image/12852d55-31ee-4474-b575-b8fdccc2e0b8', 'https://resources.directwonen.nl/image/46675f90-6038-47f6-b452-d7b3b3df2f39']"
https://directwonen.nl/huurwoningen-huren/enschede/rembrandtlaan/appartement-516857,Enschede,Rembrandtlaan,1250.0,APPARTMENT,3.0,80.0,Gemeubileerd,"Te huur mooi appartement in Enschede €1250,- excl. per maand. Het appartement ligt op circa 10 minuten van de Saxion Hogeschool en de Universiteit van Twente. Het appartement heeft een oppervlakte van 80 m2 en beschikt over drie slaapkamers. Indeling: Hal/entree, hal biedt toegang tot twee slaapkamers en de gesloten keuken v.v. diverse inbouwapparatuur. De woonkamer biedt toegang tot de derde slaapkamer. Via de woonkamer komt u in de badkamer. De badkamer is voorzien van een wastafelmeubel en een douche. Het voorschot voor gas, water, electra, internet en gemeenschappelijke belastingen bedraagt €450,-.","Beautiful apartment for rent in Enschede €1250 excl. per month. The apartment is approximately 10 minutes from the Saxion University of Applied Sciences and the University of Twente. The apartment has an area of ​​80 m2 and has three bedrooms. Layout: Hall/entrance, hall provides access to two bedrooms and the closed kitchen with various built-in appliances. The living room provides access to the third bedroom. You enter the bathroom through the living room. The bathroom has a washbasin and a shower. The advance payment for gas, water, electricity, internet and communal taxes is €450.",1,0,0,0,"['https://resources.directwonen.nl/image/2c8bd534-8677-412d-9a24-f935b0381729', 'https://resources.directwonen.nl/image/93258d69-838e-4324-936f-f39cf5e6c8c7', 'https://resources.directwonen.nl/image/de8e5b94-9d8a-4f46-ad6c-28a6a05262e9', 'https://resources.directwonen.nl/image/99b6cc86-5b59-4040-9c3a-263902fa8722', 'https://resources.directwonen.nl/image/25c3ff59-91de-43e2-a02a-4dfb50fba6b9']"
https://directwonen.nl/huurwoningen-huren/maastricht/dokter-nevenstraat/kamer-516854,Maastricht,Dokter Nevenstraat,703.0,STUDIO-ROOM,1.0,14.0,Gemeubileerd,"Kamer in een gemeubileerd studenten appartement met 4 slaapkamers gelegen op de derde etage (bij binnenkomst de linker kamer). Bestaande uit een woonkamer met open keuken (incl. inbouwapparatuur) en moderne badkamer met douche, wastafel en toilet, vier slaapkamers met ieder een tweepersoonsbed, kastruimte, bureau met stoel en sofa. Tevens is er een ontmoetingsruimte op de begane grond, studieruimtes, wasserette en fietsenstalling. Zie plattegrond voor de exacte ligging in het complex. Het complex met 127 bewoners is van alle gemakken voorzien om te wonen, studeren, ontmoeten en ontspannen. Er is een grote ontmoetingsruimte op de begane grond met gemeenschappelijke keuken, drie studieruimtes, chill out area, Miele wasserette en fietsenstalling. Daarnaast is het mogelijk om een parkeerplaats voor de auto te huren in de ondergrondse garage voor €50,00 per maand","Room in a furnished student apartment with 4 bedrooms located on the third floor (the left room upon entering). Consisting of a living room with open kitchen (including built-in appliances) and modern bathroom with shower, sink and toilet, four bedrooms, each with a double bed, cupboard space, desk with chair and sofa. There is also a meeting room on the ground floor, study rooms, laundry and bicycle shed. See the map for the exact location in the complex. The complex with 127 residents is fully equipped to live, study, meet and relax. There is a large meeting room on the ground floor with communal kitchen, three study rooms, chill out area, Miele laundry and bicycle shed. In addition, it is possible to rent a parking space for the car in the underground garage for €50.00 per month",0,0,0,1,"['https://resources.directwonen.nl/image/c415da67-1ab7-4870-ac43-a28061139fd8', 'https://resources.directwonen.nl/image/26e69534-fb10-4a7c-89f3-0d96c5e3a300', 'https://resources.directwonen.nl/image/8e988467-efa3-4241-884b-963034cc4cbf', 'https://resources.directwonen.nl/image/b4766184-8261-4a6c-a5eb-e211ce7a72f3', 'https://resources.directwonen.nl/image/943c4be7-3337-4b05-811e-f8b942ec9349']"
https://directwonen.nl/huurwoningen-huren/maastricht/kommel/kamer-516855,Maastricht,Kommel,668.0,STUDIO-ROOM,1.0,20.0,Gestoffeerd,"Leuke studentenkamer met eigen keukenblok gelegen op de eerste etage in een studentenhuis. Keuken, douche en toilet worden gedeeld met de andere studenten in huis. Er is tevens een gemeenschappelijke fietsenberging aanwezig. Het studentenhuis ligt in hartje centrum Maastricht op loopafstand van het Vrijthof en diverse faculteiten","Nice student room with its own kitchenette located on the first floor in a student house. Kitchen, shower and toilet are shared with the other students in the house. There is also a communal bicycle shed. The student house is located in the heart of Maastricht within walking distance of the Vrijthof and various faculties",0,0,0,1,"['https://resources.directwonen.nl/image/e5f63dba-eebf-41dd-8e19-ede31cbeb389', 'https://resources.directwonen.nl/image/ee07afc1-a040-4304-b6eb-5a6fd9a624a4', 'https://resources.directwonen.nl/image/0a30cc57-2498-420e-b80c-abe9f43ee090', 'https://resources.directwonen.nl/image/80073e0b-fda4-43e5-a127-5788ca6b7c04', 'https://resources.directwonen.nl/image/289b0180-a1f7-416f-acd1-b5fc0ff54031']"
https://directwonen.nl/huurwoningen-huren/arnhem/broerenstraat/appartement-516853,Arnhem,Broerenstraat,1725.0,APPARTMENT,3.0,90.0,Gestoffeerd,"TE HUUR VANAF 1 AUGUSTUS! Wij hebben Broerenstraat  in hartje Arnhem per 1 augustus aanstaande beschikbaar! Het betreft een 3-kamer appartement bij locatie ""Markt"" met een oppervlak van 90 m2, gelegen op de eerste verdieping. Balkon van ca 5 m2 op het zuiden. Lift aanwezig. De huurprijs hiervoor bedraagt € 1.725- plus € 72,50,- servicekosten per maand (excl. gas/water/licht). Complex Verto, gelegen aan de Broerenstraat  in de historische binnenstad van Arnhem, is een gebouw met historie en moderne vernuftigheid. Hier staan comfortabel wonen en leefkwaliteit voorop! Het van origine kantoorgebouw is in 2020 omgevormd tot een plek waar het goed thuiskomen is. Verto ligt midden in een compleet vernieuwd stadsgebied. Je hebt hier alles bij de hand om lekker te leven. Het filmhuis, cafés en terrasjes, restaurants, trendy winkels en het NS-station; alles is slechts een paar minuten lopen. De 58 hoogwaardig afgewerkte appartementen beschikken allen over een eigen berging in de onderbouw, een privé buitenruimte en een gezamenlijke fietsenberging met oplaadmogelijkheden voor uw rijwiel. De woning en extra's Deze woning heeft Energielabel A++. De woning is luxe uitgevoerd met vloerverwarming en een moderne laminaatvloer (breedstrook Balterio Dolce) met hoge plinten. Genieten van lekker koken in de keuken met een wit keukenblok en easy grey aanrechtblad, Siemens inbouwapparaten (inductie kookplaat, vaatwasser, combi magnetron, afzuigschouw en een Bosch koelkast met vriesgedeelte). Het balkon/ privé buitenruimte is gelegen op het zuiden. Verder is de badkamer afgewerkt met aparte douche en dubbele wastafel (en kranen) met een grote spiegel. Ook zijn de badkamer en de separate toiletruimte betegeld met een strakke afwerking. De berging bevindt zich in de kelder en is circa 4 m2 groot. Ook zijn er in complex Verto of in de Q-park parkings (beschikbaarheid onder voorbehoud) met (vrijwel) directe toegang tot het complex. De prijs voor deze parkeerplaatsen is op aanvraag. Mocht u interesse hebben, verstuur u bericht.","FOR RENT FROM AUGUST 1! We have Broerenstraat available in the heart of Arnhem as of August 1! It concerns a 3-room apartment at location ""Markt"" with an area of ​​90 m2, located on the first floor. South-facing balcony of approximately 5 m2. Elevator available. The rental price for this is € 1,725 ​​plus € 72.50 service costs per month (excl. gas/water/electricity). Complex Verto, located on Broerenstraat in the historic city center of Arnhem, is a building with history and modern ingenuity. Comfortable living and quality of life come first here! The originally office building was transformed in 2020 into a place where you can feel at home. Verto is located in the middle of a completely renovated city area. Here you have everything at hand to enjoy a good life. The cinema, cafes and terraces, restaurants, trendy shops and the railway station; everything is just a few minutes walk. The 58 high-quality apartments all have their own storage room in the basement, a private outdoor space and a shared bicycle shed with charging options for your bicycle. The house and extras This house has Energy Label A++. The house is luxuriously equipped with underfloor heating and a modern laminate floor (wide strip Balterio Dolce) with high skirting boards. Enjoy delicious cooking in the kitchen with a white kitchen unit and easy gray worktop, Siemens built-in appliances (induction hob, dishwasher, combination microwave, extractor hood and a Bosch refrigerator with freezer compartment). The balcony/private outdoor area is located on the south. Furthermore, the bathroom is finished with a separate shower and double sink (and taps) with a large mirror. The bathroom and separate toilet room are also tiled with a sleek finish. The storage room is located in the basement and is approximately 4 m2. There are also car parks in the Verto complex or in the Q-park (availability subject to availability) with (almost) direct access to the complex. The price for these parking spaces is on request. If you are interested, please send a message.",0,0,1,1,"['https://resources.directwonen.nl/image/6876f1a3-642d-420b-91b8-fdc728314a4a', 'https://resources.directwonen.nl/image/55c55c62-20f8-43cd-b7c8-37e44261e62d', 'https://resources.directwonen.nl/image/f31dcbe6-44b6-4338-9b7b-2f3179ad561b', 'https://resources.directwonen.nl/image/eb4ce95f-eda0-47f6-9b0d-cc6f3cc37ce7', 'https://resources.directwonen.nl/image/6b199c0a-f670-4b1e-8445-ca961e93c99f']"
https://directwonen.nl/huurwoningen-huren/kerkrade/marktstraat/appartement-516852,Kerkrade,Marktstraat,830.0,APPARTMENT,2.0,45.0,,"In het centrum van Kerkrade alsmede op de 2de verdieping gelegen appartement met onder andere 1 slaapkamer. Diverse voorzieningen zoals openbaar vervoer, winkels, scholen en ontsluitingswegen bevinden zich in de directe nabijheid. Begane grond: Gemeenschappelijke entree met bellentableau, brievenbussen/intercominstallatie 3d verdieping: Hal met meterkast Woonkamer met open keuken en toegang tot balkon - woonkamer 4,97m x 3,81m Keuken met apparatuur t. w.4-pits inductiekookplaat, oven en koelkast - 2,02m x 1,26m Slaapkamer met vaste kastenwand - 3,00m x 2,46m Badkamer met douche, vaste wastafel, toilet en aansluiting wasapparatuur - 2,33m x 1,40m Foto's zijn van een vergelijkbaar appartement Isolatie : kunststof kozijnen / HR++ beglazing Verwarming : collectieve CV en individuele airco Beschikbaar : juli 2026 Huurprijs : € 829,94 / maand Servicekosten (voorschot incl. verwarming en water) : € 130,- / maand Waarborgsom (renteloos) : € 1659,88 Verstuur je berichtje.","Apartment with 1 bedroom in the center of Kerkrade and on the 2nd floor. Various facilities such as public transport, shops, schools and access roads are in the immediate vicinity. Ground floor: Communal entrance with doorbells, mailboxes/intercom system 3d floor: Hall with meter cupboard Living room with open kitchen and access to balcony - living room 4.97m x 3.81m Kitchen with equipment t. w.4-burner induction hob, oven and refrigerator - 2.02m x 1.26m Bedroom with built-in cupboard wall - 3.00m x 2.46m Bathroom with shower, sink, toilet and washing equipment connection - 2.33m x 1.40m Photos are of a similar apartment Insulation: plastic frames / HR++ glazing Heating: collective central heating and individual air conditioning Available: July 2026 Rental price: €829.94 / month Service costs (advance payment incl. heating and water): €130.00 / month Deposit (interest-free): €1659.88 Send your message.",1,0,1,0,"['https://resources.directwonen.nl/image/f6ea59d9-f2c8-4ee3-a9e1-4f0b8d7b7f81', 'https://resources.directwonen.nl/image/57f22ed7-adb6-45ac-b366-ff0c484c8ce2', 'https://resources.directwonen.nl/image/d053b3e1-708f-4c08-a42d-6b95570d0437', 'https://resources.directwonen.nl/image/65ee6d41-e6d7-431d-b342-3fc0297872d3', 'https://resources.directwonen.nl/image/e2bac3af-2f9c-4c19-a4ac-c567ece19527']"
https://directwonen.nl/huurwoningen-huren/heerlen/schout-van-heeckerenring/appartement-516850,Heerlen,Schout van Heeckerenring,1350.0,APPARTMENT,4.0,110.0,Gestoffeerd,"Dit perfect onderhouden halfvrijstaand woonhuis (bouwjaar: 2012) met garage, voor- en achtertuin is gelegen aan een rustige, doodlopende weg in een nieuwbouwwijk in Heerlen Noord die grenst aan een natuurgebied met een dichte bosrand, waterpartijen en recreatieve wandel- en fietsroutes. Indeling: begane grond: entree, hal met garderobenis, meterkast, toilet met fonteintje, L-vormige woonkamer met openslaande deuren naar de tuin en garage, half open keuken voorzien van apparatuur. 1e verdieping: overloop, 3 slaapkamers, badkamer met vaste wastafel, douche en 2e toilet, c.v. -ruimte met aansluiting voor wasmachine. De begane grond en de verdieping zijn voorzien van laminaatvloeren De woning is volledig geïsoleerd, voorzien van kunststof kozijnen met HR++ isolatieglas, een HR c.v. combiketel en mechanische ventilatie bestaande uit een gebalanceerd mechanisch ventilatiesysteem met warmteterugwinning. Huurprijs € 1.350,00 per maand. De woning is voorzien van eigen energiemeters. Zekerheid middels renteloze waarborgsom ter hoogte van € 2.000,00. Minimum huurtermijn 12 maanden. Beschikbaar per 1 juli 2026 Jaarlijkse indexering van de huurprijs (per 1 juli)","This perfectly maintained semi-detached house (built in 2012) with garage, front and back garden is located on a quiet, dead-end road in a new residential area in Heerlen Noord that borders a nature reserve with a dense forest edge, water features and recreational walking and cycling routes. Layout: ground floor: entrance, hall with wardrobe alcove, meter cupboard, toilet with sink, L-shaped living room with patio doors to the garden and garage, semi-open kitchen with appliances. 1st floor: landing, 3 bedrooms, bathroom with sink, shower and 2nd toilet, central heating. -room with connection for washing machine. The ground floor and the first floor have laminate floors. The house is fully insulated, equipped with plastic frames with HR++ insulating glass, an HR central heating system. combination boiler and mechanical ventilation consisting of a balanced mechanical ventilation system with heat recovery. Rental price € 1,350.00 per month. The house is equipped with its own energy meters. Security through an interest-free deposit of € 2,000.00. Minimum rental period 12 months. Available from July 1, 2026 Annual indexation of the rental price (as of July 1)",0,0,0,0,"['https://resources.directwonen.nl/image/20aeb93a-d8df-454a-a355-fa67ef3361fa', 'https://resources.directwonen.nl/image/544a23f9-b417-4b53-8626-d7b07d706b0c', 'https://resources.directwonen.nl/image/5a373b7c-b708-47a4-92ad-8d17d799f727', 'https://resources.directwonen.nl/image/4c7d4add-0c9f-4a4b-81cd-98f4f219db67', 'https://resources.directwonen.nl/image/bceca404-9b29-4013-8f20-556f333cc634']"
https://directwonen.nl/huurwoningen-huren/almelo/kerkplein/appartement-516851,Almelo,Kerkplein,1250.0,APPARTMENT,3.0,80.0,Gestoffeerd,"Mooie bovenwoning aan het Kerkplein, hartje centrum TE HUUR OP HET MOOISTE PLEKJE VAN ALMELO Prachtig 3-kamerappartement in een nieuw kleinschalig appartementencomplex in het centrum van Almelo, te huur voor onbepaalde tijd. Het appartement is gelegen op de eerste verdieping, heeft twee slaapkamers en een klein balkon. Het is gelegen op het kerkplein midden in het centrum van Almelo en ligt nabij de Gravenallee en het pittoreske Doelengebied. INDELING: Hal, trap naar toegang appartement, twee slaapkamers met zeer ruime badkamer, apart toilet en toegang tot ruime woonkamer met open keuken.","Beautiful upstairs apartment on the Kerkplein, in the heart of the center FOR RENT IN THE MOST BEAUTIFUL PLACE OF ALMELO Beautiful 3-room apartment in a new small-scale apartment complex in the center of Almelo, for rent for an indefinite period. The apartment is located on the first floor, has two bedrooms and a small balcony. It is located on the church square in the center of Almelo and is near the Gravenallee and the picturesque Doelen area. LAYOUT: Hall, stairs to access apartment, two bedrooms with very spacious bathroom, separate toilet and access to spacious living room with open kitchen.",0,0,0,0,"['https://resources.directwonen.nl/image/dcb7903a-5b6b-4493-917f-7946c8fc4a7f', 'https://resources.directwonen.nl/image/8546454b-d34c-4015-b939-2748a3ab22c7', 'https://resources.directwonen.nl/image/26b81530-1b21-4ad3-9d4d-7c59f648b8e9', 'https://resources.directwonen.nl/image/ee391979-d7eb-4130-801c-f5dad832a15f', 'https://resources.directwonen.nl/image/37e8c61f-7956-432e-82e7-483fc01e8229']"
