link,city,street,price,type,rooms,surface,furnished,description,description_eng,near_school,near_hospital,near_public_transport,near_services,photos
https://directwonen.nl/huurwoningen-huren/eygelshoven/torenstraat/appartement-516767,Eygelshoven,Torenstraat,735.0,APPARTMENT,2.0,45.0,Gestoffeerd,"Stijlvol, recent gerenoveerd appartement in het hart van Eygelshoven Ontdek je ideale woning in Eygelshoven, op slechts enkele stappen afstand. Dit prachtig gerenoveerde appartement is afgewerkt met hoogwaardige materialen, moderne inrichting en een serene sfeer – perfect voor comfortabel wonen in Zuid-Limburg. Licht en ruim opgezet, de woning is ideaal voor maximaal twee personen en volledig gemeubileerd – gewoon intrekken en genieten! Gelegen in een rustige, vredige buurt, huisdieren zijn niet toegestaan, zodat je verzekerd bent van een kalme en ontspannen leefomgeving. Parkeren kan gemakkelijk direct voor het appartement. Toplocatie | Volledig gemeubileerd | Makkelijk parkeren | Rustig wonen","Stylish, recently renovated apartment in the heart of Eygelshoven Discover your ideal home in Eygelshoven, just a few steps away. This beautifully renovated apartment is finished with high-quality materials, modern furnishings and a serene atmosphere - perfect for comfortable living in South Limburg. Light and spacious, the home is ideal for up to two people and fully furnished – just move in and enjoy! Located in a quiet, peaceful neighborhood, pets are not allowed, ensuring a calm and relaxing living environment. Parking is easy directly in front of the apartment. Prime location | Fully furnished | Easy parking | Peaceful living",0,0,0,1,"['https://resources.directwonen.nl/image/45a7f47e-bd5a-4935-9dbe-4b5714400cf8', 'https://resources.directwonen.nl/image/7289248b-1bfd-4582-bb26-2ef8835654c6', 'https://resources.directwonen.nl/image/d36fa567-011d-465d-ae19-f6df4e26c3a3', 'https://resources.directwonen.nl/image/47fe494a-4585-47a4-8508-c896e900f589', 'https://resources.directwonen.nl/image/aa68a35f-bfba-475e-a4ee-57b66a4c674c']"
https://directwonen.nl/huurwoningen-huren/groningen/tuinbouwstraat/kamer-516753,Groningen,Tuinbouwstraat,774.0,STUDIO-ROOM,1.0,16.0,Gestoffeerd,Nette kamer met eigen keukenblok in een gerenoveerde benedenwoning aan de Tuinbouwstraat. De kamer is gelegen aan de achterkant van het huis en heeft direct toegang tot de gezamelijke tuin. De nieuwe gezamelijke keuken met inbouwapparatuur deel je met 2 huisgenoten. Dit geldt ook voor het toilet en de 2 douches. Minimale huurperiode: 12 maanden Borg: gelijk aan één maand huur Huur is 794 euro exclusief g/w/e maar wel inclusief belastingen,Neat room with its own kitchenette in a renovated ground-floor apartment on Tuinbouwstraat. The room is located at the back of the house and has direct access to the shared garden. You share the new communal kitchen with built-in appliances with 2 housemates. This also applies to the toilet and the 2 showers. Minimum rental period: 12 months Deposit: equal to one month's rent Rent is 794 euros excluding g/w/e but including taxes,0,0,0,0,"['https://resources.directwonen.nl/image/0ec7ada6-cde6-4ddc-bd94-190ddd63b047', 'https://resources.directwonen.nl/image/fdc5de21-fddb-41a0-9554-181028108258', 'https://resources.directwonen.nl/image/5a69b2a2-a5fa-444a-afbf-66c676da9871', 'https://resources.directwonen.nl/image/de97e579-8144-438e-ad02-b6e54cc26d06', 'https://resources.directwonen.nl/image/04fbc647-815a-4cad-b683-c5f72ccbe521']"
https://directwonen.nl/huurwoningen-huren/rotterdam/proveniersstraat/studio-516754,Rotterdam,Proveniersstraat,1195.0,STUDIO-ROOM,1.0,25.0,Gemeubileerd,"Prachtig gerenoveerde en gemeubileerde studio met riant op het zuiden gelegen balkon, gelegen in het centrum van Rotterdam op 1 minuut lopen van het centraal station en vlakbij het Weena, Hofplein, diverse winkels, restaurants, openbaar vervoer en uitvalswegen. De studio is gelegen op de tweede verdieping en is voorzien van meubilering, laminaat, dubbelglas en centrale verwarming. Indeling Begane grond: Gezamenlijk entree en trap naar de 2e verdieping. 2e verdieping: Entree studio, hal met separaat toilet, moderne badkamer voorzien van luxe douchecabine, wastafel, wasmachine en design radiator.De nette keuken is voorzien van een gaskookplaat, afzuigkap, combi-magnetron en koelkast. Via het woon-slaapgedeelte is het ruime balkon te bereiken. 2e verdieping: Hal (2.10 m x 0.90 m) 1.89 m2 Toilet (1.00 m x 0.95 m) 0.95 m2 Woon/slaapkamer (5.30 m x 2.50 m) 13.25 m2 Balkon (5.30 m x 1.45 m) 7.69 m2 Keuken (2.45 m x 1.45 m) 3.55 m2 Badkamer (1.50 m x 1.75 m) 2.63 m2","Beautifully renovated and furnished studio with spacious south-facing balcony, located in the center of Rotterdam, a 1-minute walk from the central station and close to the Weena, Hofplein, various shops, restaurants, public transport and arterial roads. The studio is located on the second floor and is equipped with furniture, laminate flooring, double glazing and central heating. Layout Ground floor: Shared entrance and stairs to the 2nd floor. 2nd floor: Entrance studio, hall with separate toilet, modern bathroom with luxury shower cabin, sink, washing machine and design radiator. The neat kitchen is equipped with a gas hob, extractor hood, combination microwave and refrigerator. The spacious balcony can be reached via the living-sleeping area. 2nd floor: Hall (2.10 m x 0.90 m) 1.89 m2 Toilet (1.00 m x 0.95 m) 0.95 m2 Living/bedroom (5.30 m x 2.50 m) 13.25 m2 Balcony (5.30 m x 1.45 m) 7.69 m2 Kitchen (2.45 m x 1.45 m) 3.55 m2 Bathroom (1.50 m x 1.75 m) 2.63 m2",0,0,1,0,"['https://resources.directwonen.nl/image/c765b530-7f06-45a1-854c-4f493dff546b', 'https://resources.directwonen.nl/image/c1de74d4-1d87-4eee-bf61-8ec80a988b12', 'https://resources.directwonen.nl/image/ff089683-1310-4789-b6aa-b36378d92226', 'https://resources.directwonen.nl/image/b800fd9b-f6fe-40f9-bf2c-4df4091e168e', 'https://resources.directwonen.nl/image/40661a93-9dbb-4a5e-b243-ff361b105be6']"
https://directwonen.nl/huurwoningen-huren/groningen/steentilstraat/studio-516762,Groningen,Steentilstraat,868.0,STUDIO-ROOM,2.0,35.0,Gestoffeerd,"De studio is gelegen op de 2e etage aan de voorzijde van het pand en beschikt over een eigen keuken met diverse inbouwapparatuur, een badkamer met wastafel en douche. Het toilet deel je met de medebewoners, daardoor is het aanvragen van huurtoeslag niet mogelijk. Tevens beschikt de studio over een aparte slaapkamer, met inbouwkast. Geschikt voor 1 persoon; werkend of studerend. Huurprijs € 968,- incl. voorschot gas, water en elektra. Borgsom € 968,-","The studio is located on the 2nd floor at the front of the building and has its own kitchen with various built-in appliances, a bathroom with sink and shower. You share the toilet with the fellow residents, so it is not possible to apply for housing allowance. The studio also has a separate bedroom with built-in wardrobe. Suitable for 1 person; working or studying. Rental price € 968,- incl. advance payment for gas, water and electricity. Deposit €968",0,0,0,0,"['https://resources.directwonen.nl/image/041120e4-6bc8-4389-8a45-ee1e49618827', 'https://resources.directwonen.nl/image/18ddab7b-86ed-4005-8404-e0c9dcb023bf', 'https://resources.directwonen.nl/image/06ea537c-2248-41f0-9ff2-3b89f252b7ff', 'https://resources.directwonen.nl/image/e18b3e49-82e2-4c0e-865f-3cb158410870', 'https://resources.directwonen.nl/image/b3a707ac-d10d-4bd7-871d-6717233198dd']"
https://directwonen.nl/huurwoningen-huren/geleen/markt/appartement-516764,Geleen,Markt,1999.0,APPARTMENT,3.0,96.0,,"Dit ruime appartement is gelegen in het centrum van het gezellige Geleen met leuke restaurantjes, winkels en alle andere denkbare voorzieningen op loopafstand. Daarnaast is het 8 minuten rijden naar de A2 richting Eindhoven/Maastricht. Dit appartement heeft 2 slaapkamers, een loggia en is gelegen op de 4e verdieping. Het appartementencomplex is gebouwd in 2009. Ook is er een mooie binnentuin aangelegd. Parkeren is geen probleem! - Appartement in Geleen - 2 slaapkamers - Loggia - 4e verdieping - Berging in souterrain - Bouwjaar: 2009 Voorrang Dit appartement heeft 2 slaapkamers en wordt daarom met voorrang toegewezen aan een één- of tweepersoonshuishouden.","This spacious apartment is located in the center of cozy Geleen with nice restaurants, shops and all other conceivable amenities within walking distance. In addition, it is an 8-minute drive to the A2 towards Eindhoven/Maastricht. This apartment has 2 bedrooms, a loggia and is located on the 4th floor. The apartment complex was built in 2009. There is also a beautiful courtyard. Parking is no problem! - Apartment in Geleen - 2 bedrooms - Loggia - 4th floor - Storage in the basement - Year of construction: 2009 Priority This apartment has 2 bedrooms and is therefore assigned with priority to a one- or two-person household.",0,0,0,1,['https://resources.directwonen.nl/image/1c5e9ef3-53c0-4358-924a-ec15854bcd98']
https://directwonen.nl/huurwoningen-huren/groningen/nieuwe-ebbingestraat/kamer-516765,Groningen,Nieuwe Ebbingestraat,650.0,STUDIO-ROOM,1.0,18.0,Gestoffeerd,"De kamer is gelegen op de 2e etage aan de achterzijde van de woning. Op de eerste verdieping is de badkamer en het toilet aanwezig. Dit deel je met de 3 overige bewoners van deze etage. Je deelt tevens de keuken met 3 huisgenoten. Een wasmachine is ook aanwezig. De kamer is voor onbeperkte periode beschikbaar. De huurprijs is inclusief gas, water, elektra en de gemeentelijke belasting. Tv en internet is aanwezig, dit regelen de bewoners onderling. Huurprijs € 750,- inclusief, per maand. Borgsom € 750,-","The room is located on the 2nd floor at the rear of the house. The bathroom and toilet are on the first floor. You share this with the 3 other residents of this floor. You also share the kitchen with 3 housemates. A washing machine is also available. The room is available for an unlimited period. The rental price includes gas, water, electricity and municipal tax. TV and internet are available, the residents arrange this among themselves. Rental price € 750,- inclusive, per month. Deposit €750",0,0,0,0,"['https://resources.directwonen.nl/image/25e57f7f-ba8c-4a2a-b36f-964e14b51e4d', 'https://resources.directwonen.nl/image/d1a4fce0-9da3-4b8d-8990-83b3294c7ff8', 'https://resources.directwonen.nl/image/cb14952b-04e5-4c71-b439-2573881ef5c9', 'https://resources.directwonen.nl/image/6b600aa3-0cd7-4879-bb11-8b93d566049c', 'https://resources.directwonen.nl/image/30573182-328a-4642-8adf-be2cd0c86e1b']"
https://directwonen.nl/huurwoningen-huren/roermond/monseigneur-driessenstraat/appartement-516766,Roermond,Monseigneur Driessenstraat,1135.0,APPARTMENT,3.0,85.0,,"Ruim appartement met balkon 65+ complex Enkele minuten lopen van hartje centrum Roermond Waarom wil je hier wonen? Dit ruime appartement bevindt zich aan de Mgr. Driessenstraat in Roermond. Binnen 10 minuten lopen bevind je je in het gezellige centrum van Roermond met vele winkels, supermarkten, restaurants en alle andere denkbare voorzieningen. Bovendien ligt het appartementencomplex 8 minuten lopen van het station van Roermond en ligt het ziekenhuis tegenover het complex. Dit appartement is gelegen op de 8e verdieping, heeft 2 slaapkamers, een balkon en een eigen berging in het souterrain. Wonen aan Mgr. Driessenstraat is rustig wonen in een fijn appartement met vele voorzieningen op loopafstand! - Ruim appartement op de 8e verdieping - 2 slaapkamers.","Spacious apartment with balcony 65+ complex A few minutes' walk from the heart of Roermond Why do you want to live here? This spacious apartment is located on the Mgr. Driessenstraat in Roermond. Within a 10-minute walk you will find yourself in the pleasant center of Roermond with many shops, supermarkets, restaurants and all other conceivable amenities. In addition, the apartment complex is an 8-minute walk from Roermond station and the hospital is opposite the complex. This apartment is located on the 8th floor, has 2 bedrooms, a balcony and a private storage room in the basement. Living at Mgr. Driessenstraat offers quiet living in a nice apartment with many amenities within walking distance! - Spacious apartment on the 8th floor - 2 bedrooms.",0,1,1,0,"['https://resources.directwonen.nl/image/bdf605f4-7699-41e3-bede-d332b4d22d94', 'https://resources.directwonen.nl/image/baa1a280-8280-4abd-ae0d-54b441d197e7']"
https://directwonen.nl/huurwoningen-huren/rotterdam/zuidplein/appartement-516768,Rotterdam,Zuidplein,3150.0,APPARTMENT,3.0,88.0,Gemeubileerd,"Indeling en kenmerken: 2 slaapkamers (mogelijkheid voor 3/4 kamers) Gemeubileerd Open keuken Moderne badkamer Kunststof kozijnen met dubbel glas Omschrijving: Comfortabel en centraal gelegen appartement in het bruisende hart van Rotterdam! Dit charmante appartement combineert rust en bereikbaarheid. U woont vlakbij het openbaar vervoer, waardoor u snel door de stad reist, en direct naast het grote winkelcentrum Zuidplein voor al uw dagelijkse boodschappen en gezellige winkeldagen. De omgeving is levendig en veelzijdig, met tal van voorzieningen en uitstekende verbindingen naar het centrum, werk of school. Perfect voor starters of professionals die gemak, comfort en een centrale locatie waarderen.","Layout and features: 2 bedrooms (possibility for 3/4 rooms) Furnished Open kitchen Modern bathroom Plastic window frames with double glazing Description: Comfortable and centrally located apartment in the bustling heart of Rotterdam! This charming apartment combines tranquility and accessibility. You live close to public transport, allowing you to travel quickly through the city, and right next to the large Zuidplein shopping center for all your daily shopping and fun shopping days. The area is lively and versatile, with numerous facilities and excellent connections to the center, work or school. Perfect for starters or professionals who appreciate convenience, comfort and a central location.",1,0,1,0,"['https://resources.directwonen.nl/image/f992585d-dea9-46a1-b57c-2596ff510d9b', 'https://resources.directwonen.nl/image/98f1946f-8c9d-4797-9ea0-2b27954f2819', 'https://resources.directwonen.nl/image/81b87380-38e7-4e08-904d-300c6211a42a', 'https://resources.directwonen.nl/image/842335e6-7e2f-444b-947d-c4f88d576c3a', 'https://resources.directwonen.nl/image/853336ac-19b8-427b-8217-bf716a7d3748']"
https://directwonen.nl/huurwoningen-huren/deventer/lange-bisschopstraat/appartement-516769,Deventer,Lange Bisschopstraat,335.0,APPARTMENT,2.0,55.0,Gestoffeerd,"Wonen in een appartement met openslaande deuren naar een eigen dakterras midden in het centrum van Deventer? Dan is dit wellicht wel een unieke kans. Het appartement bevindt zich midden in de prachtige binnenstad van Deventer met alle gemakken in de buurt. Student bent en tijdelijk voor uw studie in een andere gemeente huurt dan waar u woont; Het betreft een zelfstandig 2-kamer appartement met eigen woonkamer, slaapkamer, keuken, badkamer, toilet en privé dakterras. De entree van de woonruimte bevindt zich op de 1e etage van dit (winkel)pand! De IJssel en het NS-station zijn op loopafstand bereikbaar. Indeling: U betreedt het pand via een gezamenlijke entree in de winkelstraat, neemt de trap naar de 1e etage, en kom binnen in de hal. Van daaruit heeft u toegang tot de lichte woonkamer. Via zowel de woonkamer als de gang bereikt u de ruime slaapkamer, die beschikt over prachtige houten vloeren en openslaande deuren naar het privé dakterras. Vanuit de hal en het dakterras heeft u tevens toegang tot de keuken, het toilet en de badkamer.","Living in an apartment with patio doors to a private roof terrace in the center of Deventer? Then this may be a unique opportunity. The apartment is located in the beautiful city center of Deventer with all conveniences nearby. Are a student and temporarily rent for your studies in a municipality other than where you live; It is an independent 2-room apartment with its own living room, bedroom, kitchen, bathroom, toilet and private roof terrace. The entrance to the living space is located on the 1st floor of this (shop) building! The IJssel and the railway station are within walking distance. Layout: You enter the building through a shared entrance in the shopping street, take the stairs to the 1st floor and enter the hall. From there you have access to the bright living room. Through both the living room and the hallway you reach the spacious bedroom, which has beautiful wooden floors and patio doors to the private roof terrace. From the hall and the roof terrace you also have access to the kitchen, toilet and bathroom.",0,0,1,0,"['https://resources.directwonen.nl/image/db993129-4f64-44a6-ba67-cb7b0456fbfa', 'https://resources.directwonen.nl/image/c8372a55-61bd-46b8-9d64-9ece78f921a8', 'https://resources.directwonen.nl/image/b56a037c-8ce5-4d22-9261-2a4bc5751de0', 'https://resources.directwonen.nl/image/9c5abb02-5ecc-4d03-a58a-471b080ddc88', 'https://resources.directwonen.nl/image/8205685c-0b14-4524-9b21-6ebf15ceee3d']"
https://directwonen.nl/huurwoningen-huren/rotterdam/henegouwerlaan/appartement-516770,Rotterdam,Henegouwerlaan,2650.0,APPARTMENT,3.0,78.0,Gemeubileerd,"Luxe gerenoveerd appartement in Rotterdam | Ideaal voor expats en professionals Bent u op zoek naar een gemeubileerd appartement te huur in Rotterdam op een centrale locatie? Aan de Henegouwerlaan, op korte afstand van de levendige Middellandstraat, wordt momenteel een stijlvol zelfstandig appartement volledig gerenoveerd en hoogwaardig afgewerkt. Deze woning combineert modern wooncomfort met een uitstekende locatie en is ideaal voor expats, internationale professionals of een stel dat op zoek is naar hoogwaardige woonruimte in Rotterdam. De woning Dit volledig zelfstandige appartement is gelegen op de tweede verdieping van een karakteristiek Rotterdams pand en wordt momenteel volledig gerenoveerd. De woning wordt volledig gemeubileerd opgeleverd en beschikt over een moderne en praktische indeling met: 2 slaapkamers Stijlvolle woonkamer Volledig uitgeruste moderne keuken Moderne badkamer Separaat toilet Volledig gemeubileerd Hoogwaardige afwerking Eerste bewoning na renovatie Dankzij de complete renovatie biedt deze woning een unieke kans om als eerste bewoner te genieten van een volledig vernieuwd appartement op een aantrekkelijke locatie in Rotterdam. Locatie – Henegouwerlaan / Middelland Rotterdam Gelegen aan de Henegouwerlaan, vlak bij de populaire Middellandstraat, bevindt deze woning zich op een centrale en uitstekend bereikbare locatie in Rotterdam. In de directe omgeving vindt u: Diverse restaurants, cafés en lunchspots Supermarkten en dagelijkse voorzieningen Openbaar vervoer op korte afstand Snelle verbinding naar Rotterdam Centrum Goede bereikbaarheid richting Den Haag, Delft en omliggende uitvalswegen Deze locatie is bijzonder aantrekkelijk voor expats in Rotterdam en professionals die centraal willen wonen met alle voorzieningen binnen handbereik.","Luxury renovated apartment in Rotterdam | Ideal for expats and professionals Are you looking for a furnished apartment for rent in Rotterdam in a central location? On Henegouwerlaan, a short distance from the lively Middellandstraat, a stylish independent apartment is currently being completely renovated and finished to a high standard. This home combines modern living comfort with an excellent location and is ideal for expats, international professionals or a couple looking for high-quality living space in Rotterdam. The property This fully independent apartment is located on the second floor of a characteristic Rotterdam building and is currently being completely renovated. The house is delivered fully furnished and has a modern and practical layout with: 2 bedrooms Stylish living room Fully equipped modern kitchen Modern bathroom Separate toilet Fully furnished High-quality finish First occupancy after renovation Thanks to the complete renovation, this house offers a unique opportunity to be the first resident to enjoy a completely renovated apartment in an attractive location in Rotterdam. Location – Henegouwerlaan / Middelland Rotterdam Located on Henegouwerlaan, close to the popular Middellandstraat, this house is in a central and easily accessible location in Rotterdam. In the immediate vicinity you will find: Various restaurants, cafes and lunch spots Supermarkets and daily amenities Public transport a short distance away Fast connection to Rotterdam Center Good accessibility to The Hague, Delft and surrounding arterial roads This location is particularly attractive for expats in Rotterdam and professionals who want to live centrally with all amenities within easy reach.",0,0,1,0,"['https://resources.directwonen.nl/image/47da24fd-33da-41b1-ad9e-e6f15fc92843', 'https://resources.directwonen.nl/image/d02c8570-0132-48c0-92b9-1debdd0c608e', 'https://resources.directwonen.nl/image/72772c22-5d56-4638-919f-c08c00e9a1f0', 'https://resources.directwonen.nl/image/f3246878-f1a4-4351-af12-a5e904db61b3', 'https://resources.directwonen.nl/image/9e6e1955-1457-472e-9b11-311471b14352']"
https://directwonen.nl/huurwoningen-huren/den-haag/palaceplein/appartement-516771,Den Haag,Palaceplein,1925.0,APPARTMENT,2.0,75.0,Gemeubileerd,"Mooi gemeubileerd appartement met een zonnig terras en parkeerplaats in de wijk Scheveningen. Dit appartement bevindt zich in een modern gebouw en ligt op slechts een steenworp afstand van het strand en de duinen. In de nabijgelegen omgeving zijn er een grote verscheidenheid aan restaurants, een bioscoop en een winkelcentrum. Goede openbaar vervoerverbindingen naar het centraal station en het stadscentrum (tram 1 en 9 en bus 22 en 23). Bedrijven zoals Europol, ICC, NAVO en Shell zijn gemakkelijk per fiets of bus/tram te bereiken. Indeling: centrale ingang, ingang appartement, toilet, inbouwopslag met wasmachine/droger, lichte en gezellige woon/eetkamer, moderne semi-open keuken met alle apparaten, trap naar de volgende verdieping, goed formaat slaapkamer met een heerlijk zonnig dakterras, badkamer met douche, wastafel en 2e toilet. Privéparkeergelegenheid in de garage beschikbaar en een gemeenschappelijke fietsberging. Geschikt voor een internationale student.","Beautiful furnished apartment with a sunny terrace and parking space in the Scheveningen district. This apartment is located in a modern building and is just a few steps from the beach and dunes. In the nearby area there are a wide variety of restaurants, a cinema and a shopping center. Good public transport connections to the central station and the city center (tram 1 and 9 and bus 22 and 23). Companies such as Europol, ICC, NATO and Shell are easily accessible by bicycle or bus/tram. Layout: central entrance, apartment entrance, toilet, built-in storage with washer/dryer, bright and cozy living/dining room, modern semi-open kitchen with all appliances, stairs to the next floor, good-sized bedroom with a lovely sunny roof terrace, bathroom with shower, sink and 2nd toilet. Private parking available in the garage and a communal bicycle shed. Suitable for an international student.",0,0,1,1,"['https://resources.directwonen.nl/image/a423a0a2-b572-413d-9d71-f187553323d0', 'https://resources.directwonen.nl/image/58ef5953-a278-4ac8-950b-ad84dfec5799', 'https://resources.directwonen.nl/image/b2977ea4-a022-49fc-8be9-61dc8c8d5551', 'https://resources.directwonen.nl/image/6e86e016-2aef-4a03-a566-986a4243abe1', 'https://resources.directwonen.nl/image/42149eff-9fab-45ee-b83f-178665f0e35a']"
https://directwonen.nl/huurwoningen-huren/den-haag/soestdijksekade/kamer-516748,Den Haag,Soestdijksekade,708.0,STUDIO-ROOM,1.0,16.0,,"LET OP! DE WOONRUIMTE IS ENKEL BESCHIKBAAR VOOR ÉÉN STUDENT DIE NIET STAAT INGESCHREVEN IN DEN HAAG OP DIT MOMENT (KAMERVERHUUR VOOR EEN MAXIMALE DUUR VAN TWEE JAAR) Leuke kamer beschikbaar aan de Soestdijksekade in Den Haag! In dit nette pand aan de Soestdijksekade komt een ruime kamer van circa 16 m² beschikbaar. De woning deel je met één andere huurder. De keuken is uitgerust met een kookplaat, afzuigkap, koelkast, vaatwasser en combi-magnetron. De badkamer beschikt over een douche, ligbad en wastafel. De aansluiting voor de wasmachine bevindt zich in de badkamer. De kamer is voorzien van een nette laminaatvloer, raambekleding en verlichtingsarmaturen. Daarnaast beschikt de woning over een heerlijk balkon waar je samen met de andere huurder gebruik van kunt maken.","NB! THE LIVING SPACE IS ONLY AVAILABLE FOR ONE STUDENT WHO IS NOT REGISTERED IN THE HAGUE AT THE MOMENT (ROOM RENTAL FOR A MAXIMUM DURATION OF TWO YEARS) Nice room available on the Soestdijksekade in The Hague! A spacious room of approximately 16 m² will be available in this neat building on the Soestdijksekade. You share the house with one other tenant. The kitchen is equipped with a hob, extractor hood, refrigerator, dishwasher and combination microwave. The bathroom has a shower, bath and sink. The connection for the washing machine is in the bathroom. The room has a neat laminate floor, window coverings and lighting fixtures. The house also has a lovely balcony that you can use together with the other tenant.",0,0,0,0,"['https://resources.directwonen.nl/image/c2712f10-3868-430f-ad43-c298f8e1c02c', 'https://resources.directwonen.nl/image/14c8c432-ab79-4e63-b97d-4954e051498c', 'https://resources.directwonen.nl/image/0b6e6210-da18-42aa-9e57-e42f9b5fdc89']"
