link,city,street,price,type,rooms,surface,furnished,description,description_eng,near_school,near_hospital,near_public_transport,near_services,photos
https://directwonen.nl/huurwoningen-huren/maastricht/scharnerweg/appartement-516941,Maastricht,Scharnerweg,1310.0,APPARTMENT,2.0,83.0,Gestoffeerd,"Smaakvol appartement met lichte woonkamer, open keuken, één slaapkamer en een verzorgde badkamer. Dit comfortabele appartement beschikt over een ruime achtertuin. Gelegen op een geliefde locatie met winkels, horeca en openbaar vervoer binnen handbereik. Dankzij de gunstige situering zijn zowel het stadscentrum als uitvalswegen snel bereikbaar. Beschikbaar voor één huishouden. Indeling: Souterrain: Privé bergruimte. Begane grond: Via de centrale hal heeft u toegang tot alle vertrekken van de woning. De ruime en lichte woonkamer is afgewerkt met een nette laminaatvloer en beschikt over openslaande deuren naar het terras en de achtertuin, waardoor binnen en buiten naadloos in elkaar overlopen. De moderne open keuken is van alle gemakken voorzien en uitgerust met een afzuigkap, een vierpits inductiekookplaat, oven, vaatwasser en koelkast. De royale slaapkamer bevindt zich aan de voorzijde van de woning en biedt volop ruimte voor een comfortabel slaapvertrek. Vanuit de slaapkamer bereikt u de verzorgde badkamer, die is voorzien van een douche, wastafel en toilet. Deze praktische en sfeervolle indeling zorgt voor een comfortabele woonomgeving met veel licht en een fijne verbinding met de tuin.","Tasteful apartment with bright living room, open kitchen, one bedroom and a neat bathroom. This comfortable apartment has a spacious backyard. Located in a popular location with shops, restaurants and public transport within easy reach. Thanks to its favorable location, both the city center and arterial roads are quickly accessible. Available for one household. Layout: Basement: Private storage space. Ground floor: Through the central hall you have access to all rooms of the house. The spacious and bright living room is finished with a neat laminate floor and has French doors to the terrace and backyard, so that indoors and outdoors blend seamlessly. The modern open kitchen is fully equipped and equipped with an extractor hood, a four-burner induction hob, oven, dishwasher and refrigerator. The spacious bedroom is located at the front of the house and offers plenty of space for a comfortable sleeping area. From the bedroom you reach the neat bathroom, which is equipped with a shower, sink and toilet. This practical and attractive layout provides a comfortable living environment with lots of light and a nice connection with the garden.",0,0,1,0,"['https://resources.directwonen.nl/image/73bf40e8-93a8-43b0-a5ec-96930c1c6ef3', 'https://resources.directwonen.nl/image/43975402-d352-4bae-86f8-15333ff857db', 'https://resources.directwonen.nl/image/045ce7de-83e5-452f-8040-3a43e89e8da5', 'https://resources.directwonen.nl/image/7c09e58e-8799-4fb5-b92e-cf440b65c14c', 'https://resources.directwonen.nl/image/e49bb16b-7d60-462e-b0ca-161e5a7390e0']"
https://directwonen.nl/huurwoningen-huren/maastricht/vuurdoorn/woning-495820,Maastricht,Vuurdoorn,2225.0,HOUSE,4.0,125.0,Gestoffeerd,"Hoogwaardig afgewerkte hoekwoning met 3 slaapkamers, tuin en een garage. Rustig gelegen nabij de stad, diverse voorzieningen en uitvalswegen. Modern, voorzien van zonnepanelen, energie label B. Indeling: Begane grond: Entree, hal met meterkast, toilet en doorgang naar de woonkamer. De ruime woonkamer beschikt over een grote schuifpui en een vide. De open keuken is voorzien van een kookeiland en luxe inbouwapparatuur waaronder een afzuigkap, 5-pits inductiekookplaat, oven, vaatwasser en koelkast. Via een tussenhal zijn de 3 slaapkamers, badkamer, tweede toilet en wasruimte toegankelijk. De grootste slaapkamer is gelegen aan de achterzijde van de woning en beschikt over een grote kledingkast. De badkamer is voorzien van een moderne afwerking en is uitgerust met een douche en wastafel. Naast de badkamer bevindt zich nog een separaat toilet en een wasruimte met cv-ketel en wasmachineaansluiting. De tuin beschikt over een onderhoudsvriendelijk betegeld terras en biedt toegang tot de zijingang van de garage. De naast de woning gelegen garage biedt de mogelijkheid om een auto binnen te parkeren.","High-quality corner house with 3 bedrooms, garden and garage. Quietly located near the city, various amenities and highways. Modern, equipped with solar panels, energy label B. Layout: Ground floor: Entrance, hall with meter cupboard, toilet and passage to the living room. The spacious living room has large sliding doors and a loft. The open kitchen is equipped with a cooking island and luxurious built-in appliances including an extractor hood, 5-burner induction hob, oven, dishwasher and refrigerator. The 3 bedrooms, bathroom, second toilet and laundry room are accessible via an intermediate hall. The largest bedroom is located at the rear of the house and has a large wardrobe. The bathroom has a modern finish and is equipped with a shower and sink. Next to the bathroom there is a separate toilet and a laundry room with central heating boiler and washing machine connection. The garden has a low-maintenance tiled terrace and provides access to the side entrance of the garage. The garage located next to the house offers the possibility to park a car inside.",0,0,0,0,"['https://resources.directwonen.nl/image/dd841d64-1d17-4dfb-849d-c83e53c08241', 'https://resources.directwonen.nl/image/b76115e0-2434-4467-84c9-67e524fd02bc', 'https://resources.directwonen.nl/image/d3c6cfb4-4500-44e9-8b05-c61768116c3c', 'https://resources.directwonen.nl/image/d6bec6e7-47a9-436c-9d55-45ca9b879904', 'https://resources.directwonen.nl/image/4e46cb15-0aa0-478d-bc22-9e4e113b42fa']"
https://directwonen.nl/huurwoningen-huren/maastricht/brusselsestraat/studio-514949,Maastricht,Brusselsestraat,1095.0,STUDIO-ROOM,2.0,60.0,Gestoffeerd,"Eenvoudig, maar sfeervol 1 slaapkamer appartement voorzien van hoge plafonds, gelegen op de begane grond van een studentenhuis in hartje binnenstad van Maastricht. Bij binnenkomst staat u in de woonkamer welke aansluit op de half open, eenvoudige keuken met kookplaat, afzuigkap en koelkast. De badkamer is v.v. een douche cabine, toilet, wastafel en wasmachine aansluiting. De mooie slaapkamer aan de achterzijde is ruim van opzet. Bijzonderheden; Huurgegevens:","Simple, but attractive 1-bedroom apartment with high ceilings, located on the ground floor of a student house in the heart of Maastricht. Upon entering you stand in the living room which connects to the semi-open, simple kitchen with hob, extractor hood and refrigerator. The bathroom has a shower cabin, toilet, sink and washing machine connection. The beautiful bedroom at the rear is spacious. Details; Rental details:",0,0,0,0,"['https://resources.directwonen.nl/image/d86b9bde-58f0-4b27-a49c-a4b2ece1c530', 'https://resources.directwonen.nl/image/198bb413-af38-45b3-b984-a124c61dcd3a', 'https://resources.directwonen.nl/image/489597df-99f6-4bd6-9013-de79104b143d', 'https://resources.directwonen.nl/image/892a4e7d-81a1-4be4-a1a3-16ca7c2135ac', 'https://resources.directwonen.nl/image/33b721ac-b16d-40ed-b83f-126e34449a5c']"
https://directwonen.nl/huurwoningen-huren/zwolle/groenestraat/studio-516939,Zwolle,Groenestraat,590.0,STUDIO-ROOM,1.0,13.0,Gestoffeerd,"Deze semi-zelfstandige studio is gelegen op de eerste etage aan de achterkant van het pand. In de kamer bevindt zich jouw eigen keuken als toilet. De rustige locatie biedt een fijne balans tussen rust en bereikbaarheid. Snelwegen, het centrum, station en diverse winkels voor je dagelijkse boodschappen zijn snel te bereiken. Interesse? Verstuur je bericht. Ligging: Alle voorzieningen, zoals diverse verbindingswegen, centrum , station en winkels voor uw dagelijkse boodschappen bevinden zich op korte afstand. Huurprijs: € 795,00- per maand (inclusief gas, water, elektra en servicekosten)","This semi-independent studio is located on the first floor at the back of the building. Your own kitchen and toilet are located in the room. The quiet location offers a nice balance between tranquility and accessibility. Highways, the center, station and various shops for your daily shopping are quickly accessible. Interested? Send your message. Location: All amenities, such as various connecting roads, center, station and shops for your daily shopping are located a short distance away. Rental price: €795.00 per month (including gas, water, electricity and service costs)",0,0,1,0,"['https://resources.directwonen.nl/image/f217a1c7-7201-418f-bd06-40472cebea82', 'https://resources.directwonen.nl/image/08d8ddcc-4c0d-4702-88e7-64e46e989f52', 'https://resources.directwonen.nl/image/41136bbb-9597-4356-bbee-b20a01bb5328', 'https://resources.directwonen.nl/image/83e461d2-5343-481a-b7e1-7b0bea8e61da', 'https://resources.directwonen.nl/image/a71e2587-c75e-488f-8bd1-38884c3538ac']"
https://directwonen.nl/huurwoningen-huren/velp-gld/havelaarstraat/appartement-516935,Velp Gld,Havelaarstraat,1500.0,APPARTMENT,3.0,110.0,Gemeubileerd,"Te huur in Velp – volledig gemeubileerde etage! In een van de meest karakteristieke straten van Velp bieden wij een volledig gemeubileerde etage van maar liefst 110 m² aan. Deze verdieping is uitgerust met alle voorzieningen, van meubilering tot inbouwapparatuur. Dit maakt deze instapklare woning ideaal voor expats of alleenstaande werkenden. Locatie Gelegen op loop- en fietsafstand van winkels, scholen en openbaar vervoer. Arnhem ligt op slechts 5 km afstand, en biedt alle gemakken van een grote stad. Ook ligt de Posbank en haar prachtige natuurgebied letterlijk om de hoek, evenals de Rijn en de IJssel. Ook verdere bestemmingen als Utrecht, Nijmegen en Zutphen in een handomdraai bereikbaar, door de ideale bereikbaarheid via diverse uitvalswegen, trein- en busstation. Indeling & Voorzieningen Weelderige woon-/eetkamer, met open keuken Ruime slaapkamer Moderne badkamer met douche, toilet en wastafel Volledig gemeubileerd met industrieel design Volledig uitgeruste keuken met oven, elektrische kookplaat, koelkast en vaatwasser","For rent in Velp - fully furnished floor! We offer a fully furnished floor of no less than 110 m² in one of the most characteristic streets of Velp. This floor is equipped with all amenities, from furniture to built-in appliances. This makes this ready-to-live home ideal for expats or single workers. Location Located within walking and cycling distance of shops, schools and public transport. Arnhem is only 5 km away and offers all the conveniences of a big city. The Posbank and its beautiful nature reserve are also literally around the corner, as are the Rhine and the IJssel. Further destinations such as Utrecht, Nijmegen and Zutphen can also be reached in no time, due to the ideal accessibility via various arterial roads, train and bus station. Layout & Facilities Opulent living/dining room with open kitchen Spacious bedroom Modern bathroom with shower, toilet and sink Fully furnished with industrial design Fully equipped kitchen with oven, electric hob, refrigerator and dishwasher",1,0,1,0,"['https://resources.directwonen.nl/image/b7d34bf4-a590-435c-ad1a-030e3402f236', 'https://resources.directwonen.nl/image/5c3ecb1a-0f2c-42b2-9b16-18e295bf0d96', 'https://resources.directwonen.nl/image/2217937a-6da9-4211-bcb0-312a7bc54920', 'https://resources.directwonen.nl/image/851fefbc-f3e2-4e5d-977f-b6f214c98fa9', 'https://resources.directwonen.nl/image/ce4024de-080f-4a02-9f80-88396f4c30ae']"
https://directwonen.nl/huurwoningen-huren/sittard/tempelplein/kamer-516936,Sittard,Tempelplein,430.0,STUDIO-ROOM,1.0,13.0,Gestoffeerd,"In het centrum van Sittard gelegen aan het Tempelplein liggen deze studentenkamers met riant dakterras. Alle kamers zijn voorzien van een laminaatvloer, eigen wastafel en internet. Er zijn 3 toiletten en 3 badkamers. De keuken heeft twee fornuizen en een vaatwasser. De huurprijs is excl. €100,00 servicekosten per maand welke o.a. zijn voor gas/water/elektra, internet, schoonmaakkosten algemene ruimten etc. Ook is het gebruik van wasmachine en droger is bij de servicekosten inbegrepen.","These student rooms with a spacious roof terrace are located in the center of Sittard, on Tempelplein. All rooms have laminate flooring, private sink and internet. There are 3 toilets and 3 bathrooms. The kitchen has two stoves and a dishwasher. The rental price is excluding €100.00 service costs per month, which include gas/water/electricity, internet, cleaning costs for general areas, etc. The use of the washing machine and dryer is also included in the service costs.",0,0,0,0,"['https://resources.directwonen.nl/image/153a81dc-d8d6-4fd4-9325-a484db5d421d', 'https://resources.directwonen.nl/image/ce7c79ae-ee69-49e4-a1ca-f73e1d4da393', 'https://resources.directwonen.nl/image/c735f010-d108-4e44-8094-57fb7fc349db', 'https://resources.directwonen.nl/image/cf76e4bd-f8d5-41a5-89df-8903f666704a', 'https://resources.directwonen.nl/image/923a7667-686a-469b-9f7e-2c66aa1b9984']"
https://directwonen.nl/huurwoningen-huren/sittard/tempelplein/kamer-516937,Sittard,Tempelplein,420.0,STUDIO-ROOM,1.0,12.0,Gestoffeerd,"In het centrum van Sittard gelegen aan het Tempelplein liggen deze studentenkamers met riant dakterras. Alle kamers zijn voorzien van een laminaatvloer, eigen wastafel en internet. Er zijn 3 toiletten en 3 badkamers. De keuken heeft twee fornuizen en een vaatwasser. De huurprijs is excl. €100,00 servicekosten per maand welke o.a. zijn voor gas/water/elektra, internet, schoonmaakkosten algemene ruimten etc. Ook is het gebruik van wasmachine en droger is bij de servicekosten inbegrepen.","These student rooms with a spacious roof terrace are located in the center of Sittard, on Tempelplein. All rooms have laminate flooring, private sink and internet. There are 3 toilets and 3 bathrooms. The kitchen has two stoves and a dishwasher. The rental price is excluding €100.00 service costs per month, which include gas/water/electricity, internet, cleaning costs for general areas, etc. The use of the washing machine and dryer is also included in the service costs.",0,0,0,0,"['https://resources.directwonen.nl/image/1f4ef9a0-301a-4d2d-9802-a0b4e2262f03', 'https://resources.directwonen.nl/image/2737f922-0267-4a22-8a96-ae78227fc916', 'https://resources.directwonen.nl/image/001dae33-ba09-4ff6-8f99-7f4d254965a5', 'https://resources.directwonen.nl/image/d4e88fe5-6913-486c-b6eb-71d0e9ab5506', 'https://resources.directwonen.nl/image/833775a5-8400-4c25-becd-1363176a8c0b']"
https://directwonen.nl/huurwoningen-huren/groningen/radebinnensingel/appartement-516938,Groningen,Radebinnensingel,1230.0,APPARTMENT,3.0,60.0,Gestoffeerd,"RUIM TWEE-SLAAPKAMERAPPARTEMENT BESCHIKBAAR AAN DE RADEBINNENSINGEL Het appartement beschikt over alle voorzieningen voor eigen gebruik. De ruime woonkamer met open keuken biedt meer dan voldoende ruimte voor zowel een comfortabele zithoek als een eettafel. De moderne keuken is voorzien van een vaatwasser, inbouwoven, koelkast, gasfornuis en veel bergruimte. Daarnaast is er voldoende werkruimte aanwezig om uitgebreid te kunnen koken. De woning beschikt over een ruime hal en twee slaapkamers. De badkamer is voorzien van een ligbad, douche en toilet. Het ruime balkon bevindt zich op de tweede verdieping en biedt een fijne buitenruimte om van het mooie weer te genieten.","SPACIOUS TWO-BEDROOM APARTMENT AVAILABLE ON THE RADEBINNENSINGEL The apartment has all amenities for your own use. The spacious living room with open kitchen offers more than enough space for both a comfortable seating area and a dining table. The modern kitchen is equipped with a dishwasher, built-in oven, refrigerator, gas stove and plenty of storage space. In addition, there is sufficient work space to be able to cook extensively. The house has a spacious hall and two bedrooms. The bathroom has a bath, shower and toilet. The spacious balcony is located on the second floor and offers a nice outdoor space to enjoy the nice weather.",0,0,0,0,"['https://resources.directwonen.nl/image/e4ff11c8-9249-45a6-b771-7480774b019f', 'https://resources.directwonen.nl/image/07babbad-cb6b-4bcb-9b0c-003be97750a2', 'https://resources.directwonen.nl/image/0309a994-de22-48db-b50c-3f5749513f38', 'https://resources.directwonen.nl/image/4816ced6-3515-448c-b097-b9e8217351c1', 'https://resources.directwonen.nl/image/5848512b-ebda-4c4a-bc63-a7916059b77a']"
https://directwonen.nl/huurwoningen-huren/utrecht/twijnstraat/appartement-516933,Utrecht,Twijnstraat,1375.0,APPARTMENT,2.0,56.0,Gemeubileerd,"Aan een van de leukste straten van Utrecht mogen wij dit goed onderhouden GEMEUBILEERD 2 kamer appartement ca. 48m2 te huur aanbieden. De Twijnstraat is misschien wel de gezelligste winkelstraat van Utrecht met veel leuke winkeltjes zoals een bakker, groenteboer, vishandel, maar ook kledingwinkels, schoenenzaken en diverse café's en restaurants. Aan de andere zijde het Ledig Erf, een plein met diverse terrassen en een bioscoop, waar je in de zomer heerlijk kan genieten van een drankje in de zon en de gezelligheid om je heen. Indeling BG: Gemeenschappelijke entree, trapopgang naar de eerste verdieping 1e verdieping Entree, ruime woonkamer voorzien van een open keuken met een 2 pits kookplaats, oven en een koelkast met vriesvak. Trapopgang naar de slaapverdieping, ruime slaapkamer met toegang tot de badkamer voorzien van een ligbad, wastafel, wasmachine en toilet.","We can offer this well-maintained FURNISHED 2-room apartment of approx. 48m2 for rent on one of the nicest streets in Utrecht. The Twijnstraat is perhaps the nicest shopping street in Utrecht with many nice shops such as a bakery, greengrocer, fishmonger, but also clothing stores, shoe stores and various cafes and restaurants. On the other side is the Ledig Erf, a square with various terraces and a cinema, where you can enjoy a drink in the sun and the atmosphere around you in the summer. Layout Ground floor: Communal entrance, stairs to the first floor 1st floor Entrance, spacious living room with an open kitchen with a 2 burner stove, oven and a refrigerator with freezer. Stairs to the bedroom floor, spacious bedroom with access to the bathroom with a bath, sink, washing machine and toilet.",0,0,0,1,"['https://resources.directwonen.nl/image/e114afeb-a872-4594-ab79-6800b188f76b', 'https://resources.directwonen.nl/image/46614cff-10ac-481d-ab79-de14cae1ebf2', 'https://resources.directwonen.nl/image/d1497e44-f0b2-44bb-b1ab-dc7f0076eb41', 'https://resources.directwonen.nl/image/6a3256dc-d5cd-4212-815c-5e7a731634f6', 'https://resources.directwonen.nl/image/46d2147b-a388-4ab5-bdb1-c69f3c2af40b']"
https://directwonen.nl/huurwoningen-huren/rotterdam/hoogstraat/appartement-516932,Rotterdam,Hoogstraat,1750.0,APPARTMENT,3.0,64.0,Gestoffeerd,"Onlangs gerenoveerd en verduurzaamt licht en praktisch 3-kamer appartement op de Hoogstraat in hartje Centrum te huur. De woonruimte wordt in gedeeltelijk gestoffeerde staat verhuurd en is gelegen op de derde etage. In de nabije omgeving bevinden zich diverse winkels, supermarkten, de Oude Haven, de Markthal en station Blaak. Metrostation Oostplein bevindt zich op enkele passen lopen. Indeling: Woonkamer met een oppervlakte van ca. 25 m², met openslaande deuren naar Frans balkon. Keuken met een oppervlakte van ca. 6.5 m², met toegang tot het balkon van ruim 3 m². Hal met een oppervlakte van ca. 6 m². Slaapkamer met een oppervlakte van ca. 14.5 m². Extra kamer met een oppervlakte van ca. 6 m². Badkamer. Toilet.","Recently renovated and preserved, light and practical 3-room apartment on the Hoogstraat in the heart of the center for rent. The living space is rented in a partially furnished state and is located on the third floor. In the vicinity there are various shops, supermarkets, the Old Port, the Markthal and Blaak station. Oostplein metro station is a few steps away. Layout: Living room with an area of ​​approximately 25 m², with patio doors to French balcony. Kitchen with an area of ​​approximately 6.5 m², with access to the balcony of over 3 m². Hall with an area of ​​approximately 6 m². Bedroom with an area of ​​approximately 14.5 m². Additional room with an area of ​​approximately 6 m². Bathroom. Toilet.",0,0,1,0,"['https://resources.directwonen.nl/image/aa1b914e-421c-410d-a4aa-b610b6765fae', 'https://resources.directwonen.nl/image/170a757c-3fb5-4454-ba03-47add8102fb5', 'https://resources.directwonen.nl/image/11489874-ae02-41bc-b405-a325b0115607', 'https://resources.directwonen.nl/image/d10e5c5d-98ed-46a5-b11e-51d6d096cfba', 'https://resources.directwonen.nl/image/f3f8cfe2-966d-48ca-b7d7-c50bb0f1c7de']"
https://directwonen.nl/huurwoningen-huren/hilversum/gijsbrecht-van-amstelstraat/appartement-516934,Hilversum,Gijsbrecht van Amstelstraat,1138.0,APPARTMENT,2.0,64.0,Gestoffeerd,"Gelegen in het centrum van Hilversum komt per 1 augustus 2026 dit 1 slaapkamer appartement beschikbaar met dakterras! Op loopafstand van het gezellige centrum van Hilversum ligt deze sfeervolle bovenwoning. Voorzieningen zoals winkelcentrum de 'Hilvertshof', uitgaansgebied de 'Groest' en ook het treinstation van Hilversum van waaruit je in 20 minuten op Amsterdam Centraal of Utrecht staat, is op loopafstand bereikbaar. Indeling. Eerste verdieping: Entree met trapopgang. Eerste verdieping: Aangekomen op de eerste verdieping bereik je het appartement via het dakterras. Bij binnenkomst in keuken is er toegang tot de badkamer, separaat toilet, slaapkamer en de woonkamer. De woonkamer aan de voorzijde is een ruime woonkamer met grote raampartijen.","Located in the center of Hilversum, this 1-bedroom apartment with roof terrace will be available from August 1, 2026! This attractive upstairs apartment is within walking distance of the pleasant center of Hilversum. Facilities such as the 'Hilvertshof' shopping center, the 'Groest' entertainment area and also the Hilversum train station, from which you can reach Amsterdam Central Station or Utrecht in 20 minutes, are within walking distance. Layout. First floor: Entrance with stairs. First floor: Arriving on the first floor you reach the apartment via the roof terrace. Upon entering the kitchen there is access to the bathroom, separate toilet, bedroom and living room. The living room at the front is a spacious living room with large windows.",0,0,1,0,"['https://resources.directwonen.nl/image/ede816f3-f337-495d-b750-3f770782641c', 'https://resources.directwonen.nl/image/aac6ca19-e511-4a24-abbe-d1cfe4edecdb', 'https://resources.directwonen.nl/image/95e4b09c-60fe-43dc-b242-d2369d89de14', 'https://resources.directwonen.nl/image/90ffb073-babb-4c3e-888b-19c6e5c69a16', 'https://resources.directwonen.nl/image/b76bbf17-693b-4d82-83d7-30ffc0a84a20']"
https://directwonen.nl/huurwoningen-huren/wernhout/kleine-heistraat/woning-516931,Wernhout,Kleine Heistraat,1108.0,HOUSE,2.0,60.0,Gestoffeerd,"Dit appartement bevindt zich op het Parc Patersven in Wernhout. Je woont hier op de eerste verdieping en deelt het gebouw en de tuin met de bewoners op de begane grond. De woning is gelegen aan de rand van het park waardoor je aan de achterkant een mooie groene omgeving hebt. Het appartement is gemeubileerd en voorzien van een keuken, aparte slaapkamer en badkamer. Ook bevindt er zich een wasmachine in het appartement waar je gebruik van kunt maken. Slechts 1 persoon kan dit appartement huren, huurtoeslag is helaas niet mogelijk. Het houden van huisdieren is bespreekbaar. Verstuur u bericht. Huurprijs €1108,10 incl water, tv en internet excl. gas en electra.","This apartment is located at Parc Patersven in Wernhout. You live here on the first floor and share the building and garden with the residents on the ground floor. The house is located on the edge of the park, which gives you a beautiful green environment at the back. The apartment is furnished and equipped with a kitchen, separate bedroom and bathroom. There is also a washing machine in the apartment that you can use. Only 1 person can rent this apartment, housing allowance is unfortunately not possible. Keeping pets is negotiable. Send your message. Rental price €1108.10 incl. water, TV and internet excl. gas and electricity.",0,0,0,0,"['https://resources.directwonen.nl/image/6ccad152-7ba8-46e8-9d64-d4c7ef95c974', 'https://resources.directwonen.nl/image/0c424369-a170-41f3-aa8a-0150de0614ec', 'https://resources.directwonen.nl/image/2e5eddfd-4fc9-42d7-959b-9a27407c24f8', 'https://resources.directwonen.nl/image/93260e7e-a635-4c70-9d6e-c8a53438ad4c', 'https://resources.directwonen.nl/image/ed7b671e-92ea-4619-89ea-8222796e6205']"
