link,city,street,price,type,rooms,surface,furnished,description,description_eng,near_school,near_hospital,near_public_transport,near_services,photos
https://directwonen.nl/huurwoningen-huren/rotterdam/henegouwerlaan/appartement-517012,Rotterdam,Henegouwerlaan,2450.0,APPARTMENT,2.0,54.0,Gemeubileerd,"Gemeubileerd 1-Slaapkamer Appartement te Huur in Rotterdam met Dakterras – Nabij Middellandstraat Luxe gerenoveerd top floor appartement in Rotterdam | Ideaal voor expats en professionals Bent u op zoek naar een gemeubileerd appartement te huur in Rotterdam met buitenruimte op een centrale locatie? Aan de Henegouwerlaan, op korte afstand van de populaire Middellandstraat, wordt momenteel een stijlvol zelfstandig appartement volledig gerenoveerd en hoogwaardig afgewerkt. Gelegen op de bovenste verdieping van een karakteristiek Rotterdams pand, biedt deze woning een unieke combinatie van comfort, privacy en buitenruimte. Dankzij het ruime zonnige dakterras is dit appartement ideaal voor professionals of expats die op zoek zijn naar een hoogwaardige woonoplossing in Rotterdam. De woning Dit volledig zelfstandige appartement is gelegen op de bovenste verdieping en wordt momenteel volledig gerenoveerd. De woning wordt volledig gemeubileerd opgeleverd en beschikt over een moderne en efficiënte indeling met: 1 ruime slaapkamer Lichte woonkamer Volledig uitgeruste moderne keuken Moderne badkamer Privé dakterras Volledig gemeubileerd Hoogwaardige afwerking Eerste bewoning na renovatie Het zonnige dakterras vormt een absolute meerwaarde en biedt een fijne plek om buiten te ontspannen in hartje Rotterdam. Locatie – Henegouwerlaan / Middelland Rotterdam Gelegen aan de Henegouwerlaan, vlak bij de levendige Middellandstraat, bevindt deze woning zich op een centrale en uitstekend bereikbare locatie in Rotterdam. In de directe omgeving vindt u: Trendy cafés, restaurants en lunchspots Supermarkten en dagelijkse voorzieningen Openbaar vervoer op korte afstand Snelle verbinding naar Rotterdam Centrum Goede bereikbaarheid richting Den Haag, Delft en omliggende uitvalswegen Deze locatie is bijzonder aantrekkelijk voor expats in Rotterdam en professionals die centraal willen wonen met alle voorzieningen binnen handbereik.","Furnished 1-Bedroom Apartment for Rent in Rotterdam with Roof Terrace - Near Middellandstraat Luxury renovated top floor apartment in Rotterdam | Ideal for expats and professionals Are you looking for a furnished apartment for rent in Rotterdam with outdoor space in a central location? On Henegouwerlaan, a short distance from the popular Middellandstraat, a stylish independent apartment is currently being completely renovated and finished to a high standard. Located on the top floor of a characteristic Rotterdam building, this home offers a unique combination of comfort, privacy and outdoor space. Thanks to the spacious sunny roof terrace, this apartment is ideal for professionals or expats looking for a high-quality living solution in Rotterdam. The property This fully independent apartment is located on the top floor and is currently being completely renovated. The house is delivered fully furnished and has a modern and efficient layout with: 1 spacious bedroom Bright living room Fully equipped modern kitchen Modern bathroom Private roof terrace Fully furnished High-quality finish First occupancy after renovation The sunny roof terrace is an absolute added value and offers a nice place to relax outside in the heart of Rotterdam. Location – Henegouwerlaan / Middelland Rotterdam Located on Henegouwerlaan, close to the lively Middellandstraat, this house is in a central and easily accessible location in Rotterdam. In the immediate vicinity you will find: Trendy cafes, restaurants and lunch spots Supermarkets and daily amenities Public transport a short distance away Fast connection to Rotterdam Center Good accessibility to The Hague, Delft and surrounding arterial roads This location is particularly attractive for expats in Rotterdam and professionals who want to live centrally with all amenities within easy reach.",0,0,1,0,"['https://resources.directwonen.nl/image/2bee30c5-9481-4740-8881-c3ed3f19eff6', 'https://resources.directwonen.nl/image/a1c7efef-41c5-48af-8a77-4de04cbbfd8e', 'https://resources.directwonen.nl/image/37fc2198-e5db-4568-b70c-a6d0e6c04840', 'https://resources.directwonen.nl/image/600a158f-6b64-47db-82ba-f7edb366b641', 'https://resources.directwonen.nl/image/5bbaeaee-5583-4b7b-ae34-8698001db3e1']"
https://directwonen.nl/huurwoningen-huren/eindhoven/sprookjesbosch/woning-517013,Eindhoven,Sprookjesbosch,3695.0,HOUSE,3.0,169.0,Gestoffeerd,"Gelegen in de gewilde buurt Blixembosch-Oost in Eindhoven, is dit charmante eengezinswoning aan de Sprookjesbosch nu te huur. Het huis heeft een neutrale en professionele uitstraling, waardoor het geschikt is voor een breed publiek van potentiële huurders. Met de handige ligging en de gevestigde gemeenschap is deze woning ideaal voor diegenen die zich willen vestigen in een rustige en gezinsvriendelijke omgeving. Met een gezellige binnenkant en moderne voorzieningen, is dit huis perfect voor degenen die op zoek zijn naar een comfortabele en praktische woonruimte. De woning is gelegen op een royaal perceel en biedt voldoende buitenruimte om te ontspannen of te entertainen. De specifics van deze woning maken het een geweldige keuze voor individuen of gezinnen die een huis willen huren in een rustige en goed verbonden buurt. Mis de kans niet om van dit heerlijke huis je nieuwe thuis in Eindhoven te maken.","Located in the popular Blixembosch-Oost neighborhood in Eindhoven, this charming single-family home on the Sprookjesbosch is now available for rent. The house has a neutral and professional appearance, making it suitable for a wide audience of potential tenants. With its convenient location and established community, this property is ideal for those looking to settle in a quiet and family-friendly environment. With a cozy interior and modern amenities, this home is perfect for those looking for a comfortable and practical living space. The home is situated on a generous plot and offers plenty of outdoor space for relaxing or entertaining. The specifications of this property make it a great choice for individuals or families looking to rent a home in a quiet and well-connected neighborhood. Don't miss the opportunity to make this lovely house your new home in Eindhoven.",0,0,0,0,"['https://resources.directwonen.nl/image/c443b50d-fddc-468b-8cab-1fbd7448b645', 'https://resources.directwonen.nl/image/ef54aa6d-2684-4689-96a1-f96692a2a1c2', 'https://resources.directwonen.nl/image/5ee74667-169e-4926-ab16-896b40e486d6', 'https://resources.directwonen.nl/image/89df4040-ad3f-4b2a-9d18-85813bf37d9d', 'https://resources.directwonen.nl/image/0238ed1e-c209-4c64-a422-ce40b2370c23']"
https://directwonen.nl/huurwoningen-huren/eindhoven/alard-du-hamelstraat/appartement-517014,Eindhoven,Alard Du Hamelstraat,775.0,APPARTMENT,1.0,30.0,Gestoffeerd,"Dit studentenhuis appartement, gelegen aan de Alard du Hamelstraat in de gewilde Barrier wijk van Eindhoven, Nederland, is nu te huur. Met een ruime vloeroppervlakte biedt dit appartement voldoende ruimte om te studeren, ontspannen en te vermaken. De open indeling maakt veelzijdige meubelarrangementen mogelijk, waardoor het gemakkelijk is om de ruimte te personaliseren naar individuele voorkeuren. Het appartement is gelegen in een levendige buurt met een mix van winkels, restaurants en entertainment opties op loopafstand, wat bijdraagt aan de aantrekkelijkheid van deze handige locatie.","This student house apartment, located on Alard du Hamelstraat in the sought-after Barrier district of Eindhoven, Netherlands, is now available for rent. With a spacious floor space, this apartment offers plenty of space to study, relax and entertain. The open plan layout allows for versatile furniture arrangements, making it easy to personalize the space to individual preferences. The apartment is located in a vibrant area with a mix of shops, restaurants and entertainment options within walking distance, adding to the attractiveness of this convenient location.",0,0,0,0,"['https://resources.directwonen.nl/image/4f090c64-85af-4c59-918d-a55d70bc48ca', 'https://resources.directwonen.nl/image/6c57aa26-31e8-49ea-831a-138abf104393', 'https://resources.directwonen.nl/image/50693b0b-bd3c-4857-96a9-b622f5ebc302']"
https://directwonen.nl/huurwoningen-huren/utrecht/laan-van-nieuw-guinea/appartement-517015,Utrecht,Laan van Nieuw-Guinea,1595.0,APPARTMENT,2.0,48.0,Gestoffeerd,"Dit appartement is uitstekend geïsoleerd (Energielabel A) en netjes afgewerkt als ook toekomstbestendig gebouwd. Een perfecte match voor mensen die op zoek zijn naar een aardgasvrije en energiezuinige woning. Je hebt hiermee een heel comfortabel en duurzaam huis dat helemaal op de toekomst is voorbereid! Terug naar de locatie: Lombok, een begrip in Utrecht. Wie wil er niet wonen...? De wijk is in de afgelopen jaren getransformeerd tot een gewilde en levendige woon- en werkgebied met een grote diversiteit aan gebouwen en bewoners. Wonen in Lombok is een absoluut voorrecht. Een unieke mogelijkheid om het leven in de stad te combineren met een heerlijk appartement waar jij je snel thuis voelt. Lombok ligt op een centrale locatie, met diverse bedrijven en voorzieningen in de directe omgeving. De grote steden rondom Utrecht zijn goed bereikbaar met het openbaar vervoer en met de auto. Op enkele fietsminuten afstand van het Centraal Station en het oude stadscentrum van Utrecht. Wordt dit straks jouw eigen stek? Doelgroep, omgeving en voorzieningen Kies voor een heerlijk appartement op toplocatie! Dit type appartement is perfect voor jong en oud, singles of stellen en is gelegen aan een laan in de populaire woonwijk Lombok (Utrecht-West). Ook op het gebied van voorzieningen heeft Lombok veel te bieden. Van dagelijkse boodschappen tot gezellige restaurants en coffee corners: aan alles is gedacht. Wat het gebied nóg bruisender maakt zijn in de directe omgeving gelegen stadsstrand Oog in Al, Majellapark en Park Oog in Al. Net als de gezellige Kanaalstraat, het nieuwe winkelcentrum Haroekoeplein en diverse horecagelegenheden. Ook vind je op een paar minuten lopen een fijne groenvoorziening nabij aan het water, vlak bij De Munt, waar het heerlijk vertoeven is. Het Centraal Station en het centrum van Utrecht zijn met enkele fietsminuten bereikbaar. Al met al dus de perfecte locatie; een centrale locatie met alle stadse voorzieningen binnen handbereik! Ook met het openbaar vervoer zit je hier precies goed, diverse bushaltes om de hoek en binnen tien minuten zit je op verschillende uitvalswegen (A2, A12 of A27). Woon jij straks in het trendy gedeelte van Utrecht-West, dichtbij al deze voorzieningen? Maak snel een afspraak voor een vrijblijvende bezichtiging, wij laten u graag dit fraaie appartement zien! Omschrijving en indeling Het appartement kan het best beschreven worden als een zelfstandige 2-kamer benedenwoning met patio-tuintje. De woning heeft een prettige en efficiënte indeling met vloerverwarming en airco. De slaapkamer is gescheiden van de woonkamer door de keuken, badkamer en wasruimte. Ook is de woning voorzien van een fraai afgewerkt keuken met diverse inbouwapparatuur. De open keuken zorgt ervoor dat je altijd contact houdt met de woonkamer, waardoor het koken nog gezelliger wordt. De woning heeft een fijne en fraai afgewerkte badkamer met wastafelmeubel en inloop-douche. Als extra bonus heeft het appartement ook een privé patio-tuintje. Met dit type woning combineer je ruimte, luxe en comfort met het stadse leven.","This apartment is excellently insulated (Energy Label A) and neatly finished and built to be future-proof. A perfect match for people who are looking for a natural gas-free and energy-efficient home. This gives you a very comfortable and sustainable home that is completely prepared for the future! Back to the location: Lombok, a household name in Utrecht. Who wouldn't want to live there...? The district has been transformed in recent years into a popular and lively living and working area with a great diversity of buildings and residents. Living in Lombok is an absolute privilege. A unique opportunity to combine life in the city with a wonderful apartment where you will quickly feel at home. Lombok is in a central location, with various companies and facilities in the immediate vicinity. The major cities around Utrecht are easily accessible by public transport and by car. A few minutes by bike from Central Station and the old city center of Utrecht. Will this soon be your own place? Target group, environment and facilities Choose a wonderful apartment in a prime location! This type of apartment is perfect for young and old, singles or couples and is located on an avenue in the popular residential area of ​​Lombok (Utrecht-West). Lombok also has a lot to offer in terms of facilities. From daily groceries to cozy restaurants and coffee corners: everything has been thought of. What makes the area even more vibrant are the Oog in Al city beach, Majella Park and Park Oog in Al in the immediate vicinity. Just like the cozy Kanaalstraat, the new Haroekoeplein shopping center and various catering establishments. You will also find a nice green area within a few minutes' walk near the water, near De Munt, where you can relax. The Central Station and the center of Utrecht can be reached in a few minutes by bike. All in all the perfect location; a central location with all city amenities within easy reach! You are also in the right place by public transport, several bus stops around the corner and within ten minutes you are on various highways (A2, A12 or A27). Will you soon live in the trendy part of Utrecht-West, close to all these amenities? Make an appointment quickly for a no-obligation viewing, we will be happy to show you this beautiful apartment! Description and layout The apartment can best be described as an independent 2-room ground floor apartment with a patio garden. The house has a pleasant and efficient layout with underfloor heating and air conditioning. The bedroom is separated from the living room by the kitchen, bathroom and laundry room. The house also has a beautifully finished kitchen with various built-in appliances. The open kitchen ensures that you always maintain contact with the living room, making cooking even more enjoyable. The house has a nice and beautifully finished bathroom with washbasin and walk-in shower. As an added bonus, the apartment also has a private patio garden. With this type of home you combine space, luxury and comfort with city life.",0,0,1,1,"['https://resources.directwonen.nl/image/97a503cc-51b7-44c3-b723-0e4b597122e3', 'https://resources.directwonen.nl/image/688a4514-c54f-4e77-aa0c-e700e46ebad2', 'https://resources.directwonen.nl/image/e19b5775-7cbc-4b68-b1ab-28a607489479', 'https://resources.directwonen.nl/image/f0ac2515-a656-4e08-9b3a-6664b5267513', 'https://resources.directwonen.nl/image/8a7be068-36a4-49a5-87ef-386ef0ab8f28']"
https://directwonen.nl/huurwoningen-huren/arnhem/stadhoudersstraat/kamer-517016,Arnhem,Stadhoudersstraat,685.0,STUDIO-ROOM,1.0,13.0,,"In de wijk 'Het broek' een kamer beschikbaar in de Stadhoudersstraat. Deze woningen werden in 1933 gebouwd. LIGGING: - Gelegen nabij het centrum van Arnhem - Op loopafstand van winkels, supermarkten en openbaar vervoer - Goede verbinding met uitvalswegen richting A12 en A50 Deze kamer ligt aan de voorzijde van het pand op de eerste verdieping.","A room available in the Stadhoudersstraat in the 'Het Broek' district. These homes were built in 1933. LOCATION: - Located near the center of Arnhem - Within walking distance of shops, supermarkets and public transport - Good connection with highways to the A12 and A50 This room is located at the front of the building on the first floor.",0,0,1,0,"['https://resources.directwonen.nl/image/526f9199-03d6-4cd3-9021-fbfd2a3b6948', 'https://resources.directwonen.nl/image/4068cfe5-14ed-4284-8d29-fa9fde60995c', 'https://resources.directwonen.nl/image/f16813ee-5854-4b16-9e59-cb50a31dc5f7', 'https://resources.directwonen.nl/image/e56a3c48-9bd7-41d7-b684-bd5b9569f069']"
https://directwonen.nl/huurwoningen-huren/maastricht/rechtstraat/studio-517017,Maastricht,Rechtstraat,1400.0,STUDIO-ROOM,2.0,45.0,Gemeubileerd,"Sfeervolle, volledig gerenoveerde en stijlvol gemeubileerde studio, gelegen op de tweede verdieping in de populaire en levendige wijk Wyck. Deze instapklare woning combineert modern wooncomfort met een uitstekende locatie, op loopafstand van het centrum van Maastricht, het Centraal Station en diverse winkels, restaurants en gezellige terrassen. Beschikbaar voor één eenpersoonshuishouden. Indeling: Begane grond: Via het trappenhuis is het mogelijk om de tweede verdieping te betreden. Tweede verdieping: Bij binnenkomst wordt direct de sfeervolle leefruimte betreden, waarin de woonkamer, moderne keuken en slaapgedeelte op harmonieuze wijze samenkomen. De open keuken (ca. 3 m²) is volledig uitgerust met een combi-oven, vaatwasser, 4-pits inductiekookplaat en een praktische wasmachine-/drogercombinatie. De lichte woonkamer is smaakvol ingericht en profiteert van veel natuurlijke lichtinval dankzij de grote ramen aan de achterzijde van het gebouw. Het slaapgedeelte is voorzien van een comfortabel tweepersoonsbed, waardoor de studio direct instapklaar is. Via een stijlvolle schuifdeur is de moderne badkamer bereikbaar. Deze is voorzien van een douche, wastafel en toilet en beschikt over een nette, eigentijdse afwerking.","Atmospheric, completely renovated and stylishly furnished studio, located on the second floor in the popular and lively Wyck district. This ready-to-use home combines modern living comfort with an excellent location, within walking distance of the center of Maastricht, Central Station and various shops, restaurants and pleasant terraces. Available for one single household. Layout: Ground floor: It is possible to enter the second floor via the stairwell. Second floor: Upon entering you immediately enter the attractive living space, in which the living room, modern kitchen and sleeping area come together harmoniously. The open kitchen (approx. 3 m²) is fully equipped with a combination oven, dishwasher, 4-burner induction hob and a practical washing machine/dryer combination. The bright living room is tastefully decorated and benefits from plenty of natural light thanks to the large windows at the rear of the building. The sleeping area has a comfortable double bed, making the studio ready to move into. The modern bathroom is accessible via a stylish sliding door. This is equipped with a shower, sink and toilet and has a neat, contemporary finish.",0,0,1,0,"['https://resources.directwonen.nl/image/f95848a2-b77a-412c-a035-e29c4db88d99', 'https://resources.directwonen.nl/image/a94b4f76-3af2-4cd7-9337-9ea7fe22f3a3', 'https://resources.directwonen.nl/image/199cfd4b-e74b-4063-b36f-cc6659d2b178', 'https://resources.directwonen.nl/image/f916305b-c7a9-4ba3-adab-a6e789ef4a0e', 'https://resources.directwonen.nl/image/e82a0388-765a-48cb-a831-d98020c80081']"
https://directwonen.nl/huurwoningen-huren/maastricht/president-rooseveltlaan/appartement-517018,Maastricht,President Rooseveltlaan,1550.0,APPARTMENT,3.0,75.0,Gestoffeerd,"Op de Groene Loper gelegen nieuwbouw appartement met 2 slaapkamers, balkon en privé parking. Het betreft een duurzame woning voorzien van A++ energielabel en vloerverwarming. Gunstig gelegen ten opzichte van diverse voorzieningen, uitvalswegen en het station. Beschikbaar voor één huishouden. Indeling: Souterrain: Privéberging Begane grond: Gemeenschappelijke hal met toegang tot de lift en de trap. Eerste verdieping: Bij binnenkomst in het appartement word je verwelkomd in een ruime hal, die toegang biedt tot verschillende vertrekken. Vanuit de hal bereik je het separate toilet, de badkamer en de royale woonkamer met open keuken. De hal is praktisch ingedeeld en biedt voldoende ruimte voor een garderobe of opbergmogelijkheden. De ruime woonkamer, gelegen aan de voorzijde van het appartement, kenmerkt zich door een moderne en open indeling met veel natuurlijk lichtinval dankzij de grote raampartijen. De woonkamer biedt een aangename leefruimte met voldoende mogelijkheden voor een zithoek en een eetgedeelte. Vanuit de woonkamer heb je een directe toegang tot het balkon, dat een prachtig uitzicht biedt op de Groene Loper. Dit maakt het de ideale plek om te genieten van de omgeving en de buitenlucht. De woonkamer staat in directe verbinding met de open design keuken, die is ontworpen met oog voor stijl en functionaliteit. De keuken beschikt over een modern kookeiland, wat niet alleen extra werkruimte biedt, maar ook zorgt voor een sfeervolle verbinding met de woonkamer. De keuken is voorzien van hoogwaardige inbouwapparatuur, waaronder een combi magnetron, vaatwasser, koelkast en inductie kookplaat en afzuiging. Vanuit de woonkamer leidt een tussenhal naar de slaapvertrekken en de praktische wasruimte. De slaapkamers zijn gelegen aan de achterzijde waardoor je geniet van rust en privacy.","New-build apartment with 2 bedrooms, balcony and private parking, located on the Groene Loper. This is a sustainable home with an A++ energy label and underfloor heating. Conveniently located in relation to various facilities, highways and the station. Available for one household. Layout: Basement: Private storage Ground floor: Communal hall with access to the elevator and stairs. First floor: Upon entering the apartment you are welcomed in a spacious hall, which provides access to various rooms. From the hall you reach the separate toilet, the bathroom and the spacious living room with open kitchen. The hall is practically laid out and offers sufficient space for a wardrobe or storage options. The spacious living room, located at the front of the apartment, is characterized by a modern and open layout with lots of natural light thanks to the large windows. The living room offers a pleasant living space with sufficient options for a seating area and a dining area. From the living room you have direct access to the balcony, which offers a beautiful view of the Groene Loper. This makes it the ideal place to enjoy the surroundings and the fresh air. The living room is directly connected to the open design kitchen, which is designed with an eye for style and functionality. The kitchen has a modern cooking island, which not only provides extra work space, but also provides an attractive connection with the living room. The kitchen is equipped with high-quality built-in appliances, including a combination microwave, dishwasher, refrigerator and induction hob and extractor. From the living room, a hallway leads to the bedrooms and the practical laundry room. The bedrooms are located at the rear, so you can enjoy peace and privacy.",0,0,1,1,"['https://resources.directwonen.nl/image/237e3f45-f3db-4f40-905b-86e14cde8dc6', 'https://resources.directwonen.nl/image/843660ab-2b60-4070-932b-e4699b91f88d', 'https://resources.directwonen.nl/image/6dfa623d-ed28-484b-b59f-dd7fa271e9df', 'https://resources.directwonen.nl/image/16a59a51-8919-4c95-b128-97a627ee9ece', 'https://resources.directwonen.nl/image/5f6aea5c-7d59-4e0e-a3aa-75dcdc6fd303']"
